Trend,DIY_Technique
UCLA,UCLA Men Blue Slim Fit Solid Hooded Casual Shirt
FabAlley,FabAlley Women Maroon Striped High-Low Top
Steenbok,Steenbok Men Orange & White Striped Polo Collar T-shirt
Nucleus,Nucleus Women Gold-Toned Analogue Watch NPGWG
Vishudh,Vishudh Women Maroon & Gold-Toned Printed Kurti with Palazzos
Campus,Campus Women Blue Mesh Running Shoes
Puma,Puma Men Black & Grey Prime X IDP Sports Sandals
GIORDANO,GIORDANO Red Solid Shoulder Bag
Voylla,Voylla Brass Plated Gold-Toned & Beige Handcrafted Geometric Studs
Campus,Campus Men STRING-2 Black Sports Sandals
Soumya,Soumya Set of 6 Pure Cotton Printed Napkins
Soumya,Soumya Set of 6 Beige Printed Table Napkins
Home Sparkle,Home Sparkle Red & Black MDF Basic Wall Shelf
Puma,Puma Men Navy Blue Sear ID PSneakers
Kazo,Kazo Women Black & White Checked Top
ZHEIA,ZHEIA Women Navy Blue Skinny Fit Mid-Rise Clean Look Stretchable Jeans
shiloh,shiloh Women Black Regular Fit Solid Peg Trousers
Roadster,Roadster Men Navy Blue Tapered Fit Mid-Rise Mildly Distressed Stretchable Jeans
Roadster,Roadster Men Charcoal Grey Slim Fit Mid-Rise Clean Look Stretchable Jeans
INVICTUS,INVICTUS Men Orange Slim Fit Solid formal Supima Cotton Shirt
Allen Solly,Allen Solly Men Navy Blue Slim Fit Printed Casual Shirt
Mochi,Mochi Gold-Toned Embellished Clutch
UCLA,UCLA Men Beige & Black Slim Fit Checked Casual Shirt
KLEIO,KLEIO Beige Textured Sling Bag
TAYHAA,TAYHAA White Sand Stone Face Statue
Campus,Campus Men SPYCER Brown Sports Sandals
Maniac,Maniac Men Blue Printed Round Neck T-shirt
Flying Machine,Flying Machine Men Grey and Red Printed Round Neck T-shirt
ELLE,ELLE Girls White & Black Striped Round Neck T-shirt
UCLA,UCLA Men Olive Green & Yellow Slim Fit Checked Casual Shirt
KLEIO,KLEIO Peach-Coloured Solid Sling Bag
Tokyo Talkies,Tokyo Talkies Maroon Boho Print Viscose Maxi Strappy Dress
Bodycare,Bodycare Women Pack of 2 Assorted Lightly Padded T-shirt Bras E6552RAS
Kittens,Kittens Girls Gold-Toned Flatforms
ELLE,ELLE Blue Textured Handheld Bag
SOJANYA,SOJANYA Men Blue & Gold-Toned Self Design Kurta with Churidar
Roadster,Roadster Men Blue Slim Fit Mid-Rise Clean Look Stretchable Jeans
Nucleus,Nucleus Unisex White Analogue Watch NPRGWRG
Globus,Globus Women Navy Blue Printed Straight Kurta
ELLE,ELLE Women Gold-Toned Solid Block Heels
Vishudh,Vishudh Women Brown & Navy Blue Floral Print Maxi Dress
EthnoVogue,EthnoVogue Beige & Sea Green Made to Measure Lehenga with Blouse
ZHEIA,ZHEIA Women Blue Skinny Fit Mid-Rise Clean Look Stretchable Jeans
Genie,Genie Women Brown Leopard Patterned 15 inches Small Backpack
CASIO,CASIO Youth Men Blue Analogue Watch A1621 MTP-E159L-2B2DF
Bodycare,Bodycare Pack of 2 Assorted Lightly Padded T-shirt Bras E6552BFIR
Bodycare,Bodycare Pack of 2 Assorted Lightly Padded T-shirt Bras E6552LOVW
Home Sparkle,Home Sparkle Set of 2 MDF Corner Wall Shelves
VRINDA,VRINDA Rust Brown Self Design Single Door Curtain
Tokyo Talkies,Tokyo Talkies Women Mustard Regular Fit Checked Casual Shirt
ELLE,ELLE Purple & White Colourblocked Shoulder Bag
Vishudh,Vishudh Women Navy Blue Checked Straight Palazzos
Organic Harvest,Organic Harvest Unisex Anti-Pigmentation Cream 15g
ELLE,ELLE Girls Off-White & Blue Printed Round Neck T-shirt
GIORDANO,GIORDANO Yellow Solid Shoulder Bag
Bodycare,Bodycare Pack of 2 Assorted Lightly Padded T-shirt Bras E6552LOVRE
Belle Fille,Belle Fille Navy Hooded Jacket
Fourwalls,Fourwalls Set of 2 White Artificial Jasmine Flower Bales
ZHEIA,ZHEIA Women Blue Skinny Fit Mid-Rise Clean Look Stretchable Jeans
Bodycare,Bodycare Pack of 2 Assorted Lightly Padded T-shirt Bras E6552BWI
Newport,Newport Men Red Printed Round Neck T-shirt
Newport,Newport Men Red Printed Round Neck T-shirt
Miss Chase,Miss Chase Women Black Skinny Fit High-Rise Clean Look Jeans
Campus,Campus Men Navy Blue Running Shoes
Newport,Newport Men Green Printed Round Neck T-shirt
Roadster,Roadster Men Blue Acid Wash Slim Fit Mid-Rise Clean Look Stretchable Jeans
Alvaro Castagnino,Alvaro Castagnino Black & Pink Printed Pocket Square
Bodycare,Bodycare Women Pack of 2 Assorted Lightly Padded T-shirt Bras E6552RAWI
Tokyo Talkies,Tokyo Talkies Women Grey Checked Top
AKKRITI BY PANTALOONS,AKKRITI BY PANTALOONS Women Grey Printed Shirt Style Top
GIORDANO,GIORDANO Pink Solid Shoulder Bag
DressBerry,DressBerry Women Pack of 2 Solid Shoe Liners
INVICTUS,INVICTUS Men Coral Pink Slim Fit Solid Formal Shirt
Metro,Metro Women Gold-Toned Solid T-Strap Flats
Genius,Genius Unisex Grey & Black Printed 21 inches Large Overnighter Backpack
GIORDANO,GIORDANO Brown & Red Colourblocked Shoulder Bag
Vishudh,Vishudh Women Coral & Cream-Coloured Printed Flared Palazzos
HERE&NOW,HERE&NOW Women Blue Ankle Skinny Fit Mid-Rise Mildly Distressed Stretchable Cropped Jeans
Campus,Campus Men LOG Grey Sports Sandals
GIORDANO,GIORDANO Women Yellow Solid Shoulder Bag
Bohemia Crystal,Bohemia Crystal Set of 6 Rebecca Wine Glasses 540ml
EQUINOX,EQUINOX Men Maroon Regular Fit Self Design Formal Shirt
Genie,Genie Women Black Printed 17inches Medium Laptop Backpack with Pouch
Zink London,Zink London Women Off-White Printed A-Line Top
Rajasthan Decor,Rajasthan Decor Set of 2 Screen Print Pillow Cover
INVICTUS,INVICTUS Men Grey Slim Fit Checked Formal Trousers
Schwarzkopf PROFESSIONAL,Schwarzkopf PROFESSIONAL Bonacure Peptide Repair Rescue Treatment Hair Masque 200 ml
Vishudh,Vishudh Women Green Printed Kurta with Palazzos
YASH GALLERY,YASH GALLERY Women Blue Self Designed A-Line Kurta
Dennmarks,Dennmarks Multicoloured Printed Wooden Serving Tray
Vishudh,Vishudh Women Peach-Coloured Printed Kurta with Palazzos
Metro,Metro Women Gold-Toned Solid Sandals
Puma,Puma Men Red Pacer EL IDP Sneakers
Soumya,Soumya Green Single Long Door Curtain
Alena,Alena Women Grey & Yellow Printed A-Line Kurta
Genie,Genie Women Pink 15 inches Solid Small Backpack
Organic Harvest,Organic Harvest Unisex Anti-Acne Sheet Face Mask 20g
Sparx,Sparx Men Olive Green & Brown Slip-On Sneakers
ELLE,ELLE Yellow Solid Shoulder Bag
Clovia,Clovia Cotton Rich Non-Padded Non-Wired T-Shirt Bra
Dennmarks,Dennmarks Multicoloured Printed Wooden Serving Tray
Newport,Newport Men White Printed Round Neck T-shirt
Free Authority,Free Authority Men Red X-Men Printed Round Neck T-Shirt
Tokyo Talkies,Tokyo Talkies Women Rust Red Floral Printed Dress
Puma,Puma Men Blue Agile t1 NM IDP Peacoat Woven Design Sneakers
Newport,Newport Men Green Printed Round Neck T-shirt
Bodycare,Bodycare Pack of 2 Assorted Lightly Padded T-shirt Bras E6552LOVWI
VRINDA,VRINDA Mauve Door Curtain
Roadster,Roadster Men Blue Skinny Fit Mid-Rise Clean Look Stretchable Jeans
UCLA,UCLA Men Multicoloured Striped Round Neck T-shirt
Vishudh,Vishudh Women Green Embroidered Top
Alvaro Castagnino,Alvaro Castagnino Grey & Black Printed Pocket Square
UCLA,UCLA Men Brown & Navy Blue Slim Fit Checked Casual Shirt
Annabelle by Pantaloons,Annabelle by Pantaloons Women Off-White Printed Top
Ecko Unltd,Ecko Unltd Men Teal Blue Slim Fit Printed Casual Shirt
Flying Machine,Flying Machine Men Navy & White Colourblocked Round Neck T-shirt
Kazo,Kazo Women Multicoloured Printed Shirt Style Top
CASIO,Casio G-Shock Women Blue Digital watch G945 GMA-S120MF-2A2DR
KLEIO,KLEIO Women Yellow Textured Sling Bag
Bodycare,Bodycare Pack of 2 Assorted Lightly Padded T-shirt Bras E6552COW
Slub,Slub Blue Washed Slim Jeans
ELLE,ELLE Girls Blue Printed Top
Van Heusen,Van Heusen Navy Single-Breasted Slim Formal Suit
Genie,Genie Women Blue Printed 16 inches Medium Backpack
CASIO,Casio Sheen Women Silver Analogue watch SX259 SHE-4055PGL-7BUDF
Roadster,Roadster Men Blue Skinny Fit Mid-Rise Clean Look Stretchable Jeans
INVICTUS,INVICTUS Men Coffee Brown & Red Printed Slim Fit Polo Collar T-shirt
GIORDANO,GIORDANO Pink Solid Shoulder Bag
Newport,Newport Men Green & Red Printed Round Neck Slim Fit T-shirt
GIORDANO,GIORDANO Maroon & Navy Blue Colourblocked Shoulder Bag
UCLA,UCLA Men Green Solid Polo Collar T-shirt
Alena,Alena Women Mustard Yellow & Blue Printed Anarkali Kurta
UCLA,UCLA Men Grey Striped Round Neck T-shirt
Organic Harvest,Organic Harvest Unisex Sulphate Free Fresh & Glow Face Wash 100g
INVICTUS,INVICTUS Men Navy Blue & Purple Slim Fit Self Design Semiformal Shirt
Bodycare,Bodycare Pack of 2 Assorted Lightly Padded T-shirt Bras E6552DPUFIR
YK,YK Girls Green Solid Open Toe Flats with Applique Detail
Puma,Puma Men Blue Sneakers Pacer EL IDP
Red Tape,Red Tape Men Coffee Brown Derbys
Bodycare,Bodycare Pack of 2 Assorted Lightly Padded T-shirt Bras E6552BLOV
Kenneth Cole,Kenneth Cole Men Brown Leather Formal Brogues
CASIO,CASIO Enticer Women Pink Analogue watch A1577 LTP-2089D-4AVDF
Ecko Unltd,Ecko Unltd Men Navy Blue & Burgundy Regular Fit Checked Casual Shirt
FirstClap,FirstClap Kids Brown Camouflage Printed Regular Fit Dungarees
Kenneth Cole,Kenneth Cole Women Red Solid Heels
Blue Giraffe,Blue Giraffe Boys Pink Regular Fit Solid Casual Shirt
GIORDANO,GIORDANO Yellow Solid Shoulder Bag
Free Authority,Free Authority Men Black Batman Printed T-shirt
OBSESSIONS,Obsessions Universal 100% Cotton Bath Mat Grey
Vishudh,Vishudh Women Red & White Printed Flared Palazzos
Ecko Unltd,Ecko Unltd Men Navy Blue Regular Fit Checked Casual Shirt
SOJANYA,SOJANYA Men Burgundy & Gold-Coloured Self Design Kurta with Churidar
Flying Machine,Flying Machine Men Grey Printed Round Neck T-shirt
Silvermerc Designs,Silvermerc Designs Silver-Plated & White Dome Shaped Jhumkas
Sparx,Sparx Men Olive Green Mesh Running Shoes
Roadster,Roadster Men Navy Blue Super Skinny Fit Acid Wash Clean Look Stretchable Jeans
Newport,Newport Men Red Printed Round Neck T-shirt
Blue Giraffe,Blue Giraffe Boys White & Blue Regular Fit Printed Casual Shirt
Blue Giraffe,Blue Giraffe Boys White & Black Regular Fit Printed Casual Shirt
HERE&NOW,HERE&NOW Women White Skinny Fit Mid-Rise Clean Look Stretchable Jeans
Black coffee,Black coffee Men White & Blue Slim Fit Checked Formal Shirt
Genie,Genie Women Grey 15 inches Solid Small Backpack
HERE&NOW,HERE&NOW Men Green Regular Fit Solid Casual Shirt
Roadster,Roadster Men Blue Slim Fit Mid-Rise Clean Look Stretchable Jeans
Metro,Metro Women Brown Colourblocked Leather Sandals
Clovia,Clovia Women Blue & Grey Printed Night suit LS0376P03XL
Blue Giraffe,Blue Giraffe Girls Red Printed Round Neck T-shirt
ELLE,ELLE Peach-Coloured Solid Shoulder Bag
UCLA,UCLA Men Beige Solid Polo Collar T-shirt
Puma,Puma Men Grey Solid Round Neck T-shirt
CASIO,CASIO Enticer Women Silver Dial Analog Watch LTP-VT01L-7B3UDF - A1631
YASH GALLERY,YASH GALLERY Women Beige & Maroon Printed A-Line Kurta
UCLA,UCLA Men Green & Navy Blue Slim Fit Checked Casual Shirt
UCLA,UCLA Men White Solid Round Neck T-shirt
SOJANYA,SOJANYA Men Green & Gold-Coloured Self Design Kurta with Churidar
Bodycare,Bodycare Women Pack of 2 Assorted Lightly Padded T-shirt Bras E6552SWI
Annabelle by Pantaloons,Annabelle by Pantaloons Women White Sheath Dress
Roadster,Roadster Men Blue Super Skinny Fit Mid-Rise Clean Look Stretchable Jeans
Dennmarks,Dennmarks Orange Wooden Pen Stationery Holder Cum Desk Organizer
Louis Philippe,Louis Philippe Men White & Red Slim Fit Checked Formal Shirt
Roadster,Roadster Men Navy Blue Slim Fit Mid-Rise Clean Look Stretchable Jeans
Jacques Lemans,Jacques Lemans Women Black Analogue Watch 1-1811A
UCLA,UCLA Men Purple & White Slim Fit Checked Casual Shirt
Organic Harvest,Organic Harvest Unisex Sulphate Free Oil Control Face Wash 100g
Tokyo Talkies,Tokyo Talkies Women Blue Regular Fit Checked Casual Shirt
Divine Casa,Divine Casa Navy Blue & Grey Geometric Reversible AC Room 110 GSM Single Bed Dohar
OBSESSIONS,OBSESSIONS Off-White Reversible Bathmat
Flying Machine,Flying Machine Men Blue Skinny Fit Low-Rise Clean Look Stretchable Jeans
ZIYAA,ZIYAA Women Grey Printed Kurta with Trousers
Vishudh,Vishudh Women Green Floral Printed Straight Kurta
Tokyo Talkies,Tokyo Talkies Women Navy Blue Printed A-Line Top
ZHEIA,ZHEIA Women Blue Skinny Fit Mid-Rise Clean Look Stretchable Jeans
Flying Machine,Flying Machine Men Purple Solid Polo T-shirt
ELLE,ELLE Girls Blue Pineapple Print Top
Miss Chase,Miss Chase Women Blue Regular Fit Solid Culottes
Alvaro Castagnino,Alvaro Castagnino Yellow Pocket Square
GIORDANO,GIORDANO Mustard Brown Solid Handheld Bag
Soumya,Soumya Grey Single Long Door Curtains
ZHEIA,ZHEIA Women Blue Skinny Fit Mid-Rise Clean Look Stretchable Jeans
Flying Machine,Flying Machine Men Blue Skinny Fit Low-Rise Clean Look Stretchable Jeans
SKULT by Shahid Kapoor,SKULT by Shahid Kapoor Men Charcoal Grey Printed Knitted Regular Fit Joggers
TAYHAA,TAYHAA Black Resin Face Statue
GIORDANO,GIORDANO Blue Solid Handheld Bag
Roadster,Roadster Men Blue Skinny Fit Mid-Rise Clean Look Stretchable Jeans
Campus,Campus Men Navy Mesh Running Shoes
Belle Fille,Belle Fille Grey Hooded Sweatshirt
Flying Machine,Flying Machine Men Blue Micheal Slim Tapered Fit Mid-Rise Clean Look Stretchable Jeans
Bodycare,Bodycare Women Pack of 2 Assorted Lightly Padded T-shirt Bras E6552RES
Mochi,Mochi Tan Brown Solid Handheld Bag
Soumya,Soumya Lime Green Single Long Door Curtain
Schwarzkopf PROFESSIONAL,Schwarzkopf PROFESSIONAL Unisex Bonacure Q10+ Time Restore Hair Treatment Masque 200 ml
Ecko Unltd,Ecko Unltd Men Blue Super Slim Fit Mid-Rise Clean Look Stretchable Jeans
Soumya,Soumya Brown Single Long Door Curtain
Campus,Campus Men Navy Blue Mesh Running Shoes
PERFKT-U,PERFKT-U Women Pink & Blue Printed Regular Fit Capris
VRINDA,VRINDA Yellow Single Door Curtain
Puma,Puma Men Grey Solid Jacket
INVICTUS,INVICTUS Men Red Slim Fit Solid Formal Shirt
Kazo,Kazo Women Black Solid Top
Zeal,Zeal Men Maroon Standard Slim Fit Printed Casual Shirt
Organic Harvest,Organic Harvest Unisex Sulphate Free Skin Lightening Face Wash 100g
Vishudh,Vishudh Women Peach-Coloured & Gold-Toned Printed Straight Kurta
WITH,WITH Men White Slim Fit Solid Casual Shirt
Vishudh,Vishudh Women Rust Printed High-Low Top
OBSESSIONS,OBSESSIONS Set of 2 Yellow Bath Rug
Metro,Metro Women Black Solid Open Toe Flats
Roadster,Roadster Men Blue Slim Fit Mid-Rise Clean Look Stretchable Jeans
Vishudh,Vishudh Women Off-White & Red Solid Kurta with Palazzos & Dupatta
HERE&NOW,HERE&NOW Women Blue Skinny Fit Mid-Rise Mildly Distressed Stretchable Jeans
SOJANYA,SOJANYA Men Grey & Gold-Toned Self Design Kurta with Churidar
HERE&NOW,HERE&NOW Women Magenta Solid Cardigan
Cortina,Cortina Multicoloured Geometric 120 TC Cotton 1 Queen Bedsheet with 2 Pillow Covers
Vishudh,Vishudh Women White Embroidered Kurta with Palazzos
DressBerry,DressBerry Set of 2 Body Mists
Organic Harvest,Organic Harvest Unisex Age Reversal Cream 15 g
Blue Giraffe,Blue Giraffe Boys Red Regular Fit Solid Casual Shirt With Tie
plusS,plusS Women Blue Solid Jegging
ELLE,ELLE Brown Colourblocked Shoulder Bag
Vishudh,Vishudh Women Black Printed A-Line Top
Style Quotient,Style Quotient Women Blue Self Design Top
DressBerry,DressBerry Women Pack of 2 Solid Shoe Liners
Friskers,Friskers Men Blue Printed Round Neck T-shirt
Organic Harvest,Organic Harvest Unisex Sulphate Free Skin Lightening Face Wash 50g
Flying Machine,Flying Machine Men Navy Blue Slim Fit Printed Casual Shirt
Kenneth Cole,Kenneth Cole Women Black Solid Peep Toes
Rajasthan Decor,Rajasthan Decor Set of 2 Screen Print Pillow Cover
Flying Machine,Flying Machine Men Blue Tapered Fit Mid-Rise Clean Look Stretchable Jeans
Nucleus,Nucleus Women White Analogue Watch NPSWS
Vishudh,Vishudh Women Rust Orange Printed High-Low Top
Evoke 1899,Evoke 1899 Mustard Yellow Flecked T-shirt
Vishudh,Vishudh Women Red Printed Straight Palazzos
Flying Machine,Flying Machine Men White Printed Round Neck T-shirt
Unravel India,Unravel India Brown Ceramic Cylindrical Table Top Planter
Voylla,Voylla Brass Plated Gold-Toned & Beige Handcrafted Circular Studs
Peter England,Peter England Men Yellow Slim Fit Solid Casual Shirt
Wintage,Wintage Men Black Solid Woven Nehru Jacket
ZHEIA,ZHEIA Women Blue Skinny Fit Mid-Rise Clean Look Jeans
ELLE,ELLE Women Blue Solid Open Toe Heels
Flying Machine,Flying Machine Men White Printed Round Neck T-shirt
SELECTED,SELECTED Black Skinny Jeans
Tokyo Talkies,Tokyo Talkies Women Maroon Embroidered Top
V Dot,V Dot by Van Heusen Black & Maroon Regular Fit Party Suit
ZHEIA,ZHEIA Women Blue Skinny Fit Mid-Rise Clean Look Stretchable Jeans
Shoetopia,Shoetopia Women White Solid Heels
Kazo,Kazo Women Navy Blue Regular Fit Solid Casual Shirt
Belle Fille,Belle Fille Blue Tailored Jacket
Soumya,Soumya Maroon Single Long Door Curtain
Voylla,Voylla Brass Plated Gold-Toned & White Handcrafted Geometric Studs
TAYHAA,TAYHAA White Sand Stone Face Statue
MIAH Decor,MIAH Decor Red Set Of 6 Coffee Mugs
Puma,Puma Unisex Blue Puma Turin II Sneakers
Eavan,Eavan Women Grey Self Design Top
Zink London,Zink London Women White Printed A-Line Top
Puma,Puma Unisex Black Textile Running Shoes
Vishudh,Vishudh Women Navy Blue & Red Solid Palazzos
Anekaant,Anekaant Multicoloured Embroidered Clutch
Levis,Levis Men Brown Solid Biker Jacket
ZHEIA,ZHEIA Women Blue Skinny Fit Mid-Rise Clean Look Stretchable Jeans
Soumya,Soumya Grey Single Long Door Curtain
Campus,Campus Women Navy Blue Mesh Running Shoes
Free Authority,Free Authority Men Black Batman Printed T-shirt
Tokyo Talkies,Tokyo Talkies Women Red Regular Fit Checked Casual Shirt
Femmora,Femmora Women Cream-Coloured Printed Night suit
YASH GALLERY,YASH GALLERY Women Blue Pure Cotton Embroidered Top
Belle Fille,Belle Fille Black Solid Hooded Sweatshirt
Vishudh,Vishudh Women Black Fit and Flare Dress
Voylla,Voylla Gold-Toned Dome Shaped Jhumkas
Vishudh,Vishudh Women Black Checked Straight Palazzos
Vishudh,Vishudh Women Black Printed Flared Palazzos
ZHEIA,ZHEIA Women Blue Skinny Fit Mid-Rise Clean Look Stretchable Jeans
Alena,Alena Women Navy Blue & Yellow Printed A-Line Kurta
Flying Machine,Flying Machine Men White Printed Round Neck T-shirt
Free Authority,Free Authority Men Maroon X-Men Printed Round Neck T-Shirt
Bodycare,Bodycare Pack of 2 Assorted Lightly Padded T-shirt Bras E6552DPUW
Louis Philippe,Louis Philippe Men White & Red Slim Fit Striped Formal Shirt
Kazo,Kazo Women Olive Green Solid Top
Bodycare,Bodycare Pack of 2 Assorted Lightly Padded T-shirt Bras E6552DPURA
Rajasthan Decor,Rajasthan Decor Red & White Floral AC Room 120 GSM Single Bed Dohar
VRINDA,VRINDA Copper-Toned Single Door Curtain
IMYOUNG,IMYOUNG Men Yellow Printed Scoop Neck T-shirt
Campus,Campus Men HUNK Grey Blue Sports Sandals
SKULT by Shahid Kapoor,Skult By Shahid Kapoor Men Black Solid Straight-Fit Knitted Track Pants
Ecko Unltd,Ecko Unltd Men Blue Skinny Fit Mid-Rise Mildly Distressed Stretchable Cropped Jeans
Vishudh,Vishudh Women Navy Blue Striped Empire Top
Rajasthan Decor,Rajasthan Decor Set of 2 Off-White & Brown Cotton Printed Pillow Covers
Puma,Puma Men Red Sneakers
YK,YK Girls Grey Checked T-Strap Flats with Bow Detail
Genie,Genie Women Blue Textured 15 inches Small Backpack
GIORDANO,GIORDANO Tan Brown Solid Sling Bag
ELLE,ELLE Purple & Beige Self Design Shoulder Bag
Metro,Metro Women Pink Solid Open Toe Flats
ELLE,ELLE Peach-Coloured Textured Shoulder Bag
JBN Creation,JBN Creation Boys Black & Maroon Solid Sherwani Set
Urban Dog,Urban Dog Men Pack of 2 Assorted Boxers UDBX140_UDBX159
DressBerry,DressBerry Women Pack of 2 Solid Shoe Liners
Tokyo Talkies,Tokyo Talkies Pink Floral Print Maxi Belted Dress
ELLE,ELLE Girls Navy Blue Printed Round Neck T-shirt
ZHEIA,ZHEIA Women Blue Skinny Fit Mid-Rise Clean Look Stretchable Jeans
VRINDA,VRINDA Red Set of Single Door Curtains
Masch Sports,Masch Sports Men Orange Printed Round Neck T-shirt
Newport,Newport Men Green Printed Round Neck T-shirt
YASH GALLERY,YASH GALLERY Women Navy Blue Printed Pure Cotton Top
Louis Philippe,Louis Philippe Men Blue Regular Fit Striped Permapress finest wrinkle free Formal Shirt
Louis Philippe,Louis Philippe Men Blue Slim Fit Striped Formal Shirt
Puma,Puma Men Black Agile t1 NM IDP Sneakers
Vishudh,Vishudh Red Embroidered Shirt-Style Tunic
Roadster,Roadster Men Navy Blue Super Skinny Fit Mid-Rise Mildly Distressed Stretchable Jeans
Tokyo Talkies,Tokyo Talkies Women Green Solid Top
Tokyo Talkies,Tokyo Talkies Women Green Floral Print Fit and Flare Dress
Hi RELs,Hi RELs Men Brown Solid Derbys
Metro,Metro Women Black Solid T-Strap Flats
Roadster,Roadster Men Blue Super Skinny Fit Mid-Rise Clean Look Stretchable Jeans
Sparx,Sparx Men Black Slip-On Sneakers
Bohemia Crystal,Bohemia Crystal Set of 6 Green Whiskey Glasses
Campus,Campus Women Grey Mesh Running Shoes
INVICTUS,INVICTUS Men Grey & Blue Slim Fit Checked Regular Trousers
ZHEIA,ZHEIA Women Blue Skinny Fit Mid-Rise Clean Look Stretchable Jeans
Steenbok,Steenbok Men Green & White Striped Polo Collar T-shirt
ELLE,ELLE Girls Off-White Pure Cotton Printed Top
Roadster,Roadster Men Black Solid Lightweight Bomber Jacket
Annabelle by Pantaloons,Annabelle by Pantaloons Women Navy Blue Fit and Flare Dress
Alvaro Castagnino,Alvaro Castagnino Peach-Coloured Pocket Square
CASIO,Casio Sheen Women Rose Analogue watch SX239 SHE-3066PGL-4AUDF
TAYHAA,TAYHAA White Sand Stone Face Statue
DODO & MOA,DODO & MOA Women White & Pink Fit and Flare Dress
GIORDANO,GIORDANO Pink Solid Handheld Bag
Newport,Newport Men Green Printed Round Neck T-shirt
Organic Harvest,Organic Harvest Unisex Shine & Glow Sheet Mask 20gm
Belle Fille,Belle Fille Green Hooded Jacket
Allen Solly,Allen Solly Men Navy Blue Slim Fit Printed Casual Shirt
UCLA,UCLA Men White Printed Round Neck T-shirt
Newport,Newport Men Green Printed Round Neck T-shirt
Tokyo Talkies,Tokyo Talkies Women Brown Floral Printed Empire Dress
Divine Casa,Divine Casa Green & Black Geometric AC Room 110 GSM Single Bed Dohar
Alena,Alena Women Red Printed A-Line Kurta
Bohemia Crystal,Bohemia Crystal Set of 6 Yellow Cocktail Glasses
GIORDANO,GIORDANO Orange Solid Shoulder Bag
Roadster,Roadster Men Navy Blue Slim Fit Mid-Rise Clean Look Stretchable Jeans
Soumya,Soumya Beige Single Long Door Curtain
ELLE,ELLE Girls Off-White Printed Top
GIORDANO,GIORDANO Brown Solid Shoulder Bag
Louis Philippe,Louis Philippe Men Blue Regular Fit Solid Formal Shirt
ELLE,ELLE Navy Blue Solid Shoulder Bag
Home Sparkle,Home Sparkle Set of 2 Red & White MDF Corner Wall Shelves
Kenneth Cole,Kenneth Cole Men Black Leather Formal Brogues
plusS,plusS Women Pink & Off-White Maxi Dress
Flying Machine,Flying Machine Men White & Navy Blue Slim Fit Printed Casual Shirt
Alena,Alena Women Navy Blue & Pink Printed A-Line Kurta
Devis,Devis Women Blue Skinny Fit High-Rise Clean Look Stretchable Jeans
Campus,Campus Men Blue Mesh Running Shoes
CASIO,CASIO Enticer Women Rose Gold Analogue watch A1590 LTP-E141D-9AVDF
Bodycare,Bodycare Pack of 2 Assorted Lightly Padded T-shirt Bras E6552COS
Vishudh,Vishudh Women Navy Blue Empire Dress
Vishudh,Vishudh Women Black & Gold-Toned Printed Flared Palazzos
Vishudh,Vishudh Women White & Navy Blue Printed Straight Kurta
Divine Casa,Divine Casa Olive Green & Beige Geometric Reversible AC Room 110 GSM Single Bed Dohar
Roadster,Roadster Men Navy Blue Skinny Fit Mid-Rise Clean Look Stretchable Jeans
OBSESSIONS,OBSESSIONS Black & White Striped Bath Rug
ELLE,ELLE Red Solid Shoulder Bag
Divine Casa,Divine Casa Black & White Geometric Mild Winter 110 GSM Single Bed Comforter
ELLE,ELLE Girls Blue Printed Round Neck T-shirt
Namyaa,Namyaa Set of 2 Natural Lip Serums for Skin Toning + Lightening + Moisturizing 30 g Each
ONLY,ONLY Blue Washed Skorts
Puma,Puma Girls Green Solid A.C.E. Leggings G Laurel Wreath Skinny-Fit Tights
Schwarzkopf PROFESSIONAL,Schwarzkopf PROFESSIONAL Bonacure Peptide Repair Rescue Conditioner 200 ml
Bodycare,Bodycare Pack of 2 Assorted Lightly Padded T-shirt Bras E6552LOVS
DODO & MOA,DODO & MOA Women Maroon Fit and Flare Dress
SOJANYA,SOJANYA Men Olive Green Solid Asymmetric Kurta
Newport,Newport Men Red Printed Round Neck T-shirt
Eske,Eske Men Olive Green Zephyr Travel Pouch
Bohemia Crystal,Bohemia Crystal Set of 6 Claudia Wine Glasses 230ml
Genie,Genie Women Navy Blue 15 inches Solid Small Backpack
Alena,Alena Women Grey Printed A-Line Kurta
Newport,Newport Men Navy Blue Printed Round Neck T-shirt
Rajasthan Decor,Rajasthan Decor Screen Print Red Set Of Two Pillow Covers
Vishudh,Vishudh Women Teal Yoke Design Straight Kurta
Steenbok,Steenbok Men White Printed Round Neck T-shirt
ZHEIA,ZHEIA Women Blue Skinny Fit Mid-Rise Low Distress Stretchable Jeans
Roadster,Roadster Men Grey Slim Fit Mid-Rise Clean Look Stretchable Jeans
Soumya,Soumya Multicoloured Printed Single Long Door Curtain
UCLA,UCLA Men Red & Navy Blue Slim Fit Checked Casual Shirt
Louis Philippe,Louis Philippe Men White & Red Slim Fit Striped Formal Shirt
Belle Fille,Belle Fille Women Red Solid Sporty  Jacket
Campus,Campus Women Grey Mesh Running Shoes
Genie,Genie Women Red 15 inches Solid Small Backpack
Louis Philippe,Louis Philippe Men Blue Slim Fit Striped Formal Shirt
Bodycare,Bodycare Pack of 2 Assorted Lightly Padded T-shirt Bras E6552COLOV
ELLE,ELLE Black Textured Shoulder Bag
DressBerry,DressBerry Set of 3 Ivory Body Mists
Mochi,Mochi Maroon Embroidered Clutch
ELLE,ELLE Orange Solid Shoulder Bag
Campus,Campus Men Grey Mesh Running Shoes
Vishudh,Vishudh Women Black Checked Straight Palazzos
Belle Fille,Belle Fille Black Hooded Jacket
IMYOUNG,IMYOUNG Men White Printed Scoop Neck T-shirt
Namyaa,Namyaa Intimate Hygiene Wash & Whitening Serum
HERE&NOW,HERE&NOW Women Black Bootcut Mid-Rise Clean Look Stretchable Jeans
Femmora,Femmora Women Pink & Green Night suit 125601
Free Authority,Free Authority Men White Batman Printed T-shirt
V Dot,V Dot by Van Heusen Navy Single-Breasted Formal Suit
ELLE,ELLE Women Assorted Solid Sneakers
Organic Harvest,Organic Harvest Unisex Age Reversal Cream 50gm
