Trend,DIY_Technique
DKNY,DKNY Unisex Black & Grey Printed Medium Trolley Bag
EthnoVogue,EthnoVogue Women Beige & Grey Made to Measure Custom Made Kurta Set with Jacket
SPYKAR,SPYKAR Women Pink Alexa Super Skinny Fit High-Rise Clean Look Stretchable Cropped Jeans
Raymond,Raymond Men Blue Self-Design Single-Breasted Bandhgala Suit
Parx,Parx Men Brown & Off-White Slim Fit Printed Casual Shirt
SHOWOFF,SHOWOFF Men Brown Solid Slim Fit Regular Shorts
Parx,Parx Men Blue Slim Fit Checked Casual Shirt
SPYKAR,SPYKAR Women Burgundy Alexa Super Skinny Fit High-Rise Clean Look Stretchable Ankle Jeans
Parx,Parx Men Brown Tapered Fit Solid Regular Trousers
DKNY,DKNY Unisex Black Large Trolley Bag
Kenneth Cole,Kenneth Cole Women Navy Blue Solid Backpack
Parx,Parx Men Green Printed Polo Collar T-shirt
Police,Police Men To Be The King Eau De Toilette 125 ml
Vishudh,Vishudh Women Maroon Printed Kurta with Palazzos
Parx,Parx Men Red Slim Fit Checked Casual Shirt
Being Human,Being Human Clothing Navy Printed Casual Slim Shirt
Homesake,Homesake Gold-Toned & White Solid Handcrafted Table Lamp with Shade
SEJ by Nisha Gupta,SEJ by Nisha Gupta Set of 6 Mustard & Blue Printed Table Placemats
YAK YAK,YAK YAK Men Camel Brown Solid Polo Collar T-shirt
PARFAIT,PARFAIT Plus Size Black Striped Non-Wired Lightly Padded T-shirt Bra P5252
Michael Kors,Michael Kors Women Sexy Amber Eau de Parfum 100ml
HIGHLANDER,HIGHLANDER Men Mustard & Black Slim Fit Checked Casual Shirt
SEJ by Nisha Gupta,SEJ by Nisha Gupta Set of 6 Multicoloured Printed Table Placemats
SPYKAR,SPYKAR Women Blue Adora Skinny Fit Mid-Rise Clean Look Stretchable Ankle Jeans
JEWEL JUNCTION,JEWEL JUNCTION Gold-Toned Square Cufflinks
ID,ID Men Tan Brown Fisherman Leather Sandals
Story@home,Story@home Multicoloured Geometric 210TC Cotton 1 King Bedsheet with 2 Pillow Covers
Raymond,Raymond Men Blue Slim Fit Printed Formal Shirt
Gini and Jony,Gini and Jony Boys Navy Blue Regular Fit Solid Casual Shirt
SEJ by Nisha Gupta,SEJ by Nisha Gupta Set of 6 Printed Table Placemats
Sera,Sera Women Blue Printed Kurta with Palazzos
AccessHer,AccessHer Women Gold-Toned & Pink Gold-Plated AD-Studded Maang Tikka
Parx,Parx Men Blue Slim Fit Printed Casual Shirt
Alcis,Alcis Women Yellow & Blue Colorblocked Tights
ID,ID Men Brown Leather Formal Slip-Ons
Difference of Opinion,Difference of Opinion Men Navy Blue Solid Round Neck T-shirt With Side Strip Detail
Parx,Parx Men Blue Slim Fit Checked Casual Shirt
Michael Kors,Michael Kors Extreme Blue For Men Edt 70 ml
Tokyo Talkies,Tokyo Talkies Women Off-White & Pink Floral Print Fit and Flare Dress
ANNA SUI,ANNA SUI Women La Vie De Boheme EDT 75ml
HIGHLANDER,HIGHLANDER Men Navy Blue & Maroon Slim Fit Checked Casual Shirt
her by invictus,her by invictus Women Brown Solid Cushioned Mules
ID,ID Men Beige Leather Derbys
SPYKAR,SPYKAR Women Blue Adora Skinny Fit Mid-Rise Low Distress Ankle-length Stretchable Jeans
SPYKAR,SPYKAR Women Blue Adora Skinny Fit Mid-Rise Clean Look Ankle-Length Stretchable Jeans
Soie,Soie Nude-Coloured Solid Non-Wired Non Padded Maternity Bra CB-331NUDE
Lara Karen,Lara Karen Women Black Solid Maxi Satin Skirt
Gini and Jony,Gini and Jony Girls Yellow Fit and Flare Embellished Dress
Story@home,Story@home Off-White & Blue Geometric 210TC Cotton 1 King Bedsheet with 2 Pillow Covers
PARFAIT,PARFAIT Plus Size Blue Solid Underwired Lightly Padded Plunge Bra 2801
Urban Dog,Urban Dog Men Grey Solid Regular Fit Sports Shorts
ahilya,ahilya Sterling Silver Textured Bangle
PARFAIT,PARFAIT Plus Size Blue Solid Underwired Lightly Padded T-shirt Bra P5441
VASTRAMAY,VASTRAMAY Boys Navy Blue & Maroon Solid Kurta with Dhoti Pants & Jacket
Difference of Opinion,Difference of Opinion Men Grey Melange Printed Round Neck T-shirt
Campus Sutra,Campus Sutra Men White & Blue Regular Fit Colourblocked Casual Shirt
FIDO DIDO,FIDO DIDO Men White Printed Round Neck T-shirt
MIAH Decor,MIAH Decor Beige & Black Indian Art Printed Set of 4 Ceramic Bowls
JEWEL JUNCTION,JEWEL JUNCTION Gold-Toned Geometric Cufflinks
Vishudh,Vishudh Women Off-White & Green Floral Print A-Line Dress
Urban Dog,Urban Dog Men Grey Printed Regular Fit Sports Shorts
PARFAIT,PARFAIT Plus Size Women Navy Blue  White Solid Low-Rise Bikini Brief PP303
SEJ by Nisha Gupta,SEJ by Nisha Gupta Set of 6 Yellow & Blue Printed Table Placemats
ID,ID Men Brown Leather Loafers
PARFAIT,PARFAIT Plus Size Red Solid Underwired Lightly Padded T-shirt Bra P5391
SPYKAR,SPYKAR Women Blue Adora Skinny Fit Mid-Rise Mildly Distressed Stretchable Cropped Jeans
SPYKAR,SPYKAR Women Blue Adora Skinny Fit Mid-Rise Clean Look Stretchable Cropped Jeans
Raymond,Raymond Men Blue Regular Fit Self Design Formal Shirt
BuckleUp,BuckleUp Women Multicoloured Printed Belt
Peter England,Peter England Men Black Briefs PIWBK9146012
AIGNER,AIGNER Men Platinum Eau De Toilette Perfume 100 ml
Gini and Jony,Gini and Jony Girls Blue Solid Jacket
Homesake,Homesake Gold-Toned Solid Handcrafted Table Lamp with Shade
Campus Sutra,Campus Sutra Men Black Solid Round Neck Faux Leather T-shirt
MIAH Decor,MIAH Decor Set of 3 Blue & Off-White Handpainted Kitchen Storage Jars with Lids
Gini and Jony,Gini and Jony Girls Peach-Coloured Floral Embroidered Fit & Flare Dress
SEJ by Nisha Gupta,SEJ by Nisha Gupta Blue & Green Printed Wooden Open Dry Bin
Parx,Parx Men Blue Slim Fit Checked Casual Shirt
PARFAIT,PARFAIT Plus Size Black Lace Non-Wired Non Padded Everyday Bra P5482
Parx,Parx Men Blue Slim Fit Checked Casual Shirt
Lady Lyka,Lady Lyka Women Pack of 2 Beginners Bras TEENAGER-WHT-BLK
SEJ by Nisha Gupta,SEJ by Nisha Gupta Set of 4 Multicoloured Printed Table Placemats
her by invictus,her by invictus Women Red Cushioned Loafers
JEWEL JUNCTION,JEWEL JUNCTION Gold-Toned & Black Round Cufflinks
PARFAIT,PARFAIT Plus Size Black Solid Non-Wired Non Padded Sports Bra P5542
her by invictus,her by invictus Women Tan Brown Cushioned Slip-on Shoes
DKNY,DKNY Unisex Black Medium Trolley Bag
Parx,Parx Men Yellow & Off-White Slim Fit Checked Casual Shirt
Story@home,Story@home Mauve & Grey Geometric 210 TC Cotton 1 King Bedsheet with 2 Pillow Covers
Parx,Parx Men Blue & Off-White Slim Fit Printed Casual Shirt
her by invictus,her by invictus Women Green Cushioned Slip-Ons
Park Avenue,Park Avenue Women Blue Skinny Fit Mid-Rise Clean Look Jeans
Roadster,Roadster Women Black Textured Open Toe Flats
her by invictus,her by invictus Women Black Textured Cushioned Flats
U.S. Polo Assn. Denim Co.,U.S. Polo Assn. Denim Co. Men Navy Blue Solid Bomber Jacket
SEJ by Nisha Gupta,SEJ by Nisha Gupta Set of 6 Pink Printed Table Placemats
Gini and Jony,Gini and Jony Girls Navy Blue Washed Denim Jacket
Sweet Dreams,Sweet Dreams Men Navy Blue Solid Straight-Fit Trackpants
Kazo,Kazo Women Yellow Floral Print Shirt Dress
Gini and Jony,Gini and Jony Boys Red & Grey Melange Solid Varsity Jacket with Applique Detail
PARFAIT,PARFAIT Plus Size Beige Solid Underwired Lightly Padded Plunge Bra 2801
Parx,Parx Men Blue Slim Fit Checked Casual Shirt
Parx,Parx Men Black & Red Slim Fit Checked Casual Shirt
ID,ID Men Tan Brown Formal Leather Oxfords
Stylo Bug,Stylo Bug Girls Turquoise Blue A-Line Dress
PARFAIT,PARFAIT Plus Size Women Black  Red Printed Lace Detail Hipster Brief 2805
MIAH Decor,MIAH Decor Set Of 5 Handcrafted Ceramic Kulladhs
JEWEL JUNCTION,JEWEL JUNCTION Gold-Toned Geometric Cufflinks
Tokyo Talkies,Tokyo Talkies Women Black & Red Floral Print Fit and Flare Dress
SEJ by Nisha Gupta,SEJ by Nisha Gupta Set of 6 Printed Table Placemats
Sera,Sera Women Black Printed Loose Fit Regular Shorts
Gini and Jony,Gini and Jony Boys Black & Grey Embroidered Regular Fit Shorts
AccessHer,AccessHer Gold-Plated & Black Multistrand Head Chain
Bvlgari,Bvlgari Women Splendida Iris D'Or Eau De Parfum 100 ml
ahilya,ahilya Sterling Silver Statement Ring
SPYKAR,SPYKAR Women Blue Alexa Super Skinny Fit High-Rise Clean Look Stretchable Cropped Jeans
FIDO DIDO,FIDO DIDO Men Grey & Black Printed Colourblocked Polo Collar T-shirt
Parx,Parx Men Pink Slim Fit Solid Casual Shirt
Parx,Parx Men Navy Blue Slim Fit Printed Casual Shirt
Sera,Sera Women White Self Design Top
Bvlgari,Bvlgari Women Omnia Crystalline Eau De Toilette 40 ml
ID,ID Men Grey Solid Thong Flip-Flops
JEWEL JUNCTION,JEWEL JUNCTION Silver-Toned Geometric Cufflinks
DKNY,DKNY Unisex Gold & White Printed Cabin Trolley Bag
Parx,Parx Men Khaki Slim Fit Solid Regular Trousers
Qraa Men,Qraa Men Pack of 2 Face And Beard Wash 100gm each
PARFAIT,PARFAIT Plus Size Blue Lace Underwired Lightly Padded Plunge Bra P5351
Lady Lyka,Lady Lyka Women Peach and Burgundy Pack of 2 Everyday Bras ENTIZER-11-PCH-WHN
Difference of Opinion,Difference of Opinion Men Olive Green Printed Round Neck T-shirt
Michael Kors,Michael Kors Women Eau de Toilette 50 ml
Homesake,Homesake Gold-Toned & White Solid Handcrafted Table Lamp with Shade
ID,ID Men Black Leather Formal Derbys
Soie,Soie Brown Underwired Non Padded full coverage Everyday Bra FB-610CRIMSON
GAS,GAS Women Navy Blue Regular Fit Mid-Rise Clean Look Stretchable Jeans
Homesake,Homesake Gold-Toned & Navy Blue Solid Handcrafted Table Lamp with Shade
HIGHLANDER,HIGHLANDER Men Navy Blue & Grey Slim Fit Striped Regular Trousers
WITH,WITH Men Black Slim Fit Solid Casual Shirt
ID,ID Men Black Leather Formal Derbys
SPYKAR,SPYKAR Women White Alexa Super Skinny Fit High-Rise Clean Look Stretchable Ankle Jeans
ZUSH,ZUSH Plus Size Women Black Regular Fit Mid-Rise Clean Look Jeans
Story@home,Story@home Mustard Floral 210 TC Cotton 1 King Bedsheet with 2 Pillow Covers
DKNY,DKNY Unisex Gold & White Printed Large Trolley Bag
Campus Sutra,Campus Sutra Men Green & Navy Blue Regular Fit Checked Casual Shirt
Campus Sutra,Campus Sutra Men Navy & Grey Melange Standard Regular Fit Colourblocked Casual Shirt
Parx,Parx Men Blue Slim Fit Checked Casual Shirt
JBN Creation,JBN Creation Boys Maroon & Brown Sherwani Set
U.S. Polo Assn. Kids,U.S. Polo Assn. Kids Boys Navy Hooded Sweatshirt
Bvlgari,Bvlgari Women Omnia Paraiba Eau De Toilette Perfume 65 ml
PARFAIT,PARFAIT Plus Size Black Solid Underwired Lightly Padded Everyday Bra P5011
PARFAIT,PARFAIT Plus Size Beige Self Design Underwired Non Padded Minimizer Bra P5272
JEWEL JUNCTION,JEWEL JUNCTION Silver-Toned Geometric Cufflinks
DKNY,DKNY Unisex Black Large Trolley Bag
DressBerry,DressBerry Off-White Sequinned Top
Parx,Parx Men Blue Slim Fit Checked Casual Shirt
BuckleUp,BuckleUp Women Blue Textured Belt
Gini and Jony,Gini and Jony Boys Black & White Regular Fit Printed Trousers
PARFAIT,PARFAIT Plus Size Women Lavender Lace Boy Shorts 2805
Bvlgari,Bvlgari Goldea Women The Roman Night Eau De Parfum 75 ml
Parx,Parx Men Maroon Slim Fit Printed Casual Shirt
ColorPlus,ColorPlus Men Blue Regular Fit Checked Formal Trousers
Parx,Parx Men Off-White & Blue Slim Fit Printed Casual Shirt
HIGHLANDER,HIGHLANDER Men Grey Slim Fit Self Design Regular Trousers
Parx,Parx Men Beige Slim Fit Solid Regular Trousers
Tokyo Talkies,Tokyo Talkies Women Green Solid Top
BuckleUp,BuckleUp Women Tan Textured Belt
SPYKAR,SPYKAR Women Black Alexa Super Skinny Fit High-Rise Clean Look Stretchable Jeans
MIAH Decor,MIAH Decor Set Of 2 Ceramic Bowls
Lakme,Lakme Absolute Matte Melt Liquid Lip Color - 21 Mauve Mix 6 ml
Campus Sutra,Campus Sutra Men Blue & White Ombre-Dyed Henley Neck T-shirt
Allen Solly Woman,Allen Solly Woman Women White Printed Top
Palm Tree,Palm Tree Girls Pink Solid Bomber Jacket
PARFAIT,PARFAIT Plus Size Purple  Pink Lace Underwired Lightly Padded T-shirt Bra P5581
Arrow,Arrow Taupe Tapered Fit Formal Trousers
JEWEL JUNCTION,JEWEL JUNCTION Silver-Toned Geometric Cufflinks
Difference of Opinion,Difference of Opinion Men Mustard Yellow Solid Round Neck T-shirt with Printed Detailing
AccessHer,AccessHer Women Gold-Plated & White Kundan-Studded Flower-Shaped Nosepin
HIGHLANDER,HIGHLANDER Men Grey & Black Striped Round Neck T-shirt
Lady Lyka,Lady Lyka Women Pack of 2 Beginners Bras TEENAGER-RED-WHT
DKNY,DKNY Unisex Silver Medium Trolley Bag
Raymond,Raymond Men Green Printed Polo Collar T-shirt
Lakme,Lakme Absolute Matte Melt Liquid Lip Color - 23 Pink Poison 6 ml
Lakme,Lakme Absolute Mattreal Mousse Concealer - Caramel 04 9 g
DAVID BECKHAM,DAVID BECKHAM Men Respect Eau De Toilette 90 ml
AccessHer,AccessHer Gold-Toned & Yellow Classic Drop Earrings
MANGO,MANGO Women Black & Yellow Floral Print Layered Top
Park Avenue,Park Avenue Women Maroon Self Design Top
ahilya,ahilya Maroon Gold-Plated Sterling Silver Hoop Earrings
AccessHer,AccessHer Gold-Plated & Black Beaded Mangalsutra
Lady Lyka,Lady Lyka Women Beige and White Pack of 2 Beginners Bras ATHLETE-SKN-WHT-Multi
Story@home,Story@home Blue & Pink Floral 210 TC Cotton 1 King Bedsheet with 2 Pillow Covers
Urban Dog,Urban Dog Men Charcoal Black Printed Regular Fit Sports Shorts
ID,ID Men Beige Solid Leather Mid-Top Flat Boots
Carrera,Carrera Men Tan Brown Flat Boots
Story@home,Story@home Olive Green & Grey Geometric 210 TC Cotton 1 King Bedsheet with 2 Pillow Covers
Campus Sutra,Campus Sutra Men Red & Black Standard Regular Fit Checked Casual Shirt
Gini and Jony,Gini and Jony Boys Black Regular Fit Solid Chinos
Story@home,Story@home Green & White Floral 210 TC Cotton 1 King Bedsheet with 2 Pillow Covers
DKNY,DKNY Unisex Maroon Solid Leather Backpack with Pouch
Parx,Parx Men Khaki Tapered Fit Solid Regular Trousers
Soie,Soie Green Self Design Underwired Non Padded Everyday Bra FB-610
Raymond,Raymond Men Maroon Striped Polo Collar T-shirt
Lakme,Lakme Absolute Matte Melt Liquid Lip Color - 15 Rose Love 6 ml
Gini and Jony,Gini and Jony Girls Navy Blue Denim Striped Pinafore Dress
PARFAIT,PARFAIT Plus Size Black Solid Underwired Lightly Padded Everyday Bra 4815
Parx,Parx Men White & Blue Slim Fit Printed Casual Shirt
Urban Dog,Urban Dog Men Black Printed Regular Fit Sports Shorts
Campus Sutra,Campus Sutra Men Blue Standard Regular Fit Checked Casual Shirt
EthnoVogue,EthnoVogue Women Coral Pink & Orange Printed Made to Measure Printed Maxi Dress
PARFAIT,PARFAIT Plus Size Black Solid Underwired Lightly Padded T-shirt Bra 4812
Lady Lyka,Lady Lyka Women Brown and Grey Pack of 2 Everyday Bras COULOUR-POP-BRN-GRY
PARFAIT,PARFAIT Plus Size Women Navy Blue Solid Hipster Brief P5645
Tokyo Talkies,Tokyo Talkies Women Burgundy Solid Top
Parx,Parx Men Blue & Yellow Slim Fit Checked Casual Shirt
ROMEE,ROMEE Grey & Red Floral AC Room 300 GSM Single Bed Dohar
ZUSH,ZUSH Plus Size Women Black Regular Fit Mid-Rise Clean Look Jeans
Lady Lyka,Lady Lyka Women Maroon and Beige Pack of 2 Everyday Bras MONALISA-MRN-SKN-Multi
TAYHAA,TAYHAA White Solid Rectangular Photo Frame
Gini and Jony,Gini and Jony Boys Navy Blue Slim Fit Printed Regular Trousers
Ishin,Ishin Women Red & Gold-Toned Hem Design Wide Leg Palazzos
Shoe Couture,Shoe Couture Women White & Black Applique Detail Sneakers
MIAH Decor,MIAH Decor Multicoloured Coffee Mugs Cum Serving Tea Cups Set
Parx,Parx Men Red & Blue Slim Fit Checked Casual Shirt
WITH,WITH Men Pack of 2 Printed Pure Cotton Boxers WB43-WB54
PARFAIT,PARFAIT Plus Size Red Lace Underwired Non Padded Everyday Bra P5392
PARFAIT,PARFAIT Plus Size Women Navy Blue  White Solid Bikini Briefs PP503
HARBORNBAY,HARBORNBAY Men Navy Blue & Grey Striped Henley Neck T-shirt
Difference of Opinion,Difference of Opinion Men Black Printed Round Neck T-shirt
SPYKAR,SPYKAR Women Blue Alicia Super Skinny Fit Low-Rise Clean Look Stretchable Cropped Jeans
Parx,Parx Men Blue Slim Fit Self Design Regular Trousers
Lady Lyka,Lady Lyka Women Beige and White Pack of 2 Everyday Bras SONAL-SKN-WHT-Multi
Gini and Jony,Gini and Jony Boys Navy Blue Dyed Printed Round Neck T-shirt
Palm Tree,Palm Tree Girls Cream-Coloured & Yellow Floral Print A-Line Dress with Belt
Raymond,Raymond Men Grey Slim Fit Solid Formal Trousers
JEWEL JUNCTION,JEWEL JUNCTION Gold-Toned Geometric Cufflinks
Story@home,Story@home Multicoloured Geometric 210TC Cotton 1 King Bedsheet with 2 Pillow Covers
Palm Tree,Palm Tree Boys White & Grey Printed Polo Collar T-shirt
SPYKAR,SPYKAR Women Blue Elissa Bootcut High-Rise Clean Look Stretchable Ankle Jeans
ID,ID Men Beige Leather Derbys
Keds,Keds Women Multicoloured Iridescent Effect Slip-On Sneakers
Parx,Parx Men Blue Slim Fit Colourblocked Casual Shirt
Parx,Parx Men Grey Solid Sweater
Homesake,Homesake Gold-Toned & Navy Blue Solid Handcrafted Table Lamp with Shade
Parx,Parx Men Grey Slim Fit Printed Casual Shirt
SEJ by Nisha Gupta,SEJ by Nisha Gupta Blue & Pink Printed Wooden Open Dry Bin
Rozia,Rozia Women Hair Dryer HC8307
ID,ID Men Olive Green Leather Derbys
Gini and Jony,Gini and Jony Girls Blue Printed Round Neck T-shirt
her by invictus,her by invictus Women Red Cushioned Slip-Ons
HARBORNBAY,HARBORNBAY Women Red & Silver Printed Round Neck T-shirt
Aj DEZInES,Aj DEZInES Boys Red Printed Kurta with Pyjamas
Gini and Jony,Gini and Jony Boys Blue Regular Fit Mid-Rise Clean Look Stretchable Jeans
AccessHer,AccessHer Gold-Plated & Blue Geometric Drop Earrings
Monte Carlo,Monte Carlo Women Navy Blue Skinny Fit Mid-Rise Clean Look Jeans
Lady Lyka,Lady Lyka Women Pack of 2 Beginners Bras TEENAGER-SKN-BLK
ID,ID Men Tan Brown Comfort Sandals
Parx,Parx Men Khaki Slim Fit Solid Regular Trousers
PARFAIT,PARFAIT Plus Size Nude-Coloured Solid Underwired Lightly Padded Balconette Bra P5011
Lady Lyka,Lady Lyka Women Black and Beige Pack of 2 Everyday Bras MONALISA-BLK-SKN
PARFAIT,PARFAIT Plus Size Beige Solid Underwired Lightly Padded Plunge Bra P5490
Gini and Jony,Gini and Jony Boys Blue Slim Fit Mid-Rise Clean Look Jeans
ahilya,ahilya Imperial Filigree Collection Gold-Plated Sterling Silver Drop Earrings
Parx,Parx Men White Printed Polo Collar T-shirt
Parx,Parx Men Navy Blue Slim Fit Printed Casual Shirt
SPYKAR,SPYKAR Women Blue Alexa Super Skinny Fit High-Rise Clean Look Stretchable Jeans
SEJ by Nisha Gupta,SEJ by Nisha Gupta Mustard & Blue Printed Wooden Open Dry Bin
SEJ by Nisha Gupta,SEJ by Nisha Gupta Orange & Pink Printed Wooden Open Dry Bin
Tokyo Talkies,Tokyo Talkies Women Teal Floral Printed Peplum Top
JEWEL JUNCTION,JEWEL JUNCTION Silver-Toned Geometric Cufflinks
Gini and Jony,Gini and Jony Girls Chambray Blue & White Printed Chambray Top with Shorts
Bvlgari,Bvlgari Women Rose Goldea Eau De Perfume 90 ml
Urban Dog,Urban Dog Men Navy Blue Printed Regular Fit Sports Shorts
HIGHLANDER,HIGHLANDER Men Purple & Beige Slim Fit Printed Casual Shirt
VASTRAMAY,VASTRAMAY Boys Brown & Blue Solid Kurta with Churidar & Jacket
DKNY,DKNY Unisex Black & Grey Printed Cabin Trolley Bag
SEJ by Nisha Gupta,SEJ by Nisha Gupta Set of 4 Green & Blue Printed Table Placemats
Palm Tree,Palm Tree Girls Burgundy Printed Round Neck T-shirt
Bvlgari,Bvlgari Splendida Women Rose Eau De Parfum 50 ml
Parx,Parx Men Pink & Blue Striped Polo Collar T-shirt
even,even Men Grey Woven Design Nehru Jacket
PARFAIT,PARFAIT Plus Size Beige Solid Underwired Lightly Padded T-shirt Bra 4812
ID,ID Men Tan Brown Solid Comfort Leather Sandals
Parx,Parx Men White & Orange Slim Fit Checked Casual Shirt
ether,ether Women Maroon Solid Suede Finish Open Toe Flats
Crimsoune Club,Crimsoune Club Men Orange & White Slim Fit Checked Casual Shirt
SEJ by Nisha Gupta,SEJ by Nisha Gupta Red & Blue Printed Wooden Open Dry Bin
Urban Dog,Urban Dog Men Navy Blue Solid Regular Fit Sports Shorts
Carrera,Carrera Men Grey Sneakers
Aj DEZInES,Aj DEZInES Boys Peach-Coloured & Brown Solid Kurta with Pyjamas
PARFAIT,PARFAIT Plus Size Beige Solid Underwired Lightly Padded Everyday Bra 6901
JEWEL JUNCTION,JEWEL JUNCTION Men Silver-Toned & Blue Geometric Cufflinks
Gini and Jony,Gini and Jony Boys Grey & White Embroidered Round Neck T-shirt with Applique Detail
JEWEL JUNCTION,JEWEL JUNCTION Men Gold-Toned Geometric Cufflinks
Homesake,Homesake Gold-Toned & White Solid Handcrafted Table Lamp with Shade
U.S. Polo Assn. Kids,U.S. Polo Assn. Kids Boys Yellow Hooded Sweatshirt
HIGHLANDER,HIGHLANDER Men White & Grey Slim Fit Striped Casual Shirt
SEJ by Nisha Gupta,SEJ by Nisha Gupta Set of 4 Multicoloured Printed Table Placemats
her by invictus,her by invictus Women Black Solid Cushioned Smart Casual Derbys
Lakme,Lakme 9To5 Eye Quartet Eyeshadow - Royal Peacock 7 g
Homesake,Homesake Gold-Toned & Red Solid Handcrafted Table Lamp with Shade
SPYKAR,SPYKAR Women Blue Adora Skinny Fit High-Rise Low Distressed Stretchable Ankle Jeans
Russell Athletic,Russell Athletic Black Printed Hooded Sweatshirt
Gini and Jony,Gini and Jony Girls Peach-Coloured & Blue Embroidered Top
Sera,Sera Women Green & Blue Printed Kurta with Palazzos
MIMOSA,MIMOSA Navy Blue & Red Art Silk Woven Design Kanjeevaram Saree
Kazo,Kazo Women Green Smocked Peplum Top
Gini and Jony,Gini and Jony Girls Blue Regular Fit Mid-Rise Clean Look Stretchable Jeans
SEJ by Nisha Gupta,SEJ by Nisha Gupta Pink & Black Printed Wooden Open Dry Bin
Bvlgari,Goldea Edp 90Ml
Vishudh,Vishudh Women Mustard Orange & Pink Floral Print Maxi Dress
Gini and Jony,Gini and Jony Boys Navy Blue Regular Fit Mid-Rise Clean Look Stretchable Jeans
Puma,Puma Men Blue Sneakers
Raymond,Raymond Men Grey Solid Single-Breasted Formal Blazer
ahilya,ahilya Sterling Silver Bangle
ID,ID Men Tan Brown Leather Loafers
MIAH Decor,MIAH Decor Brown Set of 3 Printed Ceramic Art Storage Jar
ether,ether Women Beige Solid Open Toe Flats
Peter England,Peter England Men Pink & Blue Striped Briefs PIWBPH9186011
Campus Sutra,Campus Sutra Men Maroon Ombre-Dyed Henley Neck T-shirt
Parx,Parx Men Cream-Coloured Tapered Fit Solid Regular Trousers
Parx,Parx Men Blue Slim Fit Checked Casual Shirt
AIGNER,AIGNER Men Blue Eau de Toilette 125 ml
SPYKAR,SPYKAR Women Black Alexa Super Skinny Fit High-Rise Clean Look Stretchable Ankle Jeans
Campus Sutra,Campus Sutra Men Blue Colourblocked Round Neck T-shirt
Campus Sutra,Campus Sutra Men Blue & Black Standard Regular Fit Checked Casual Shirt
Gini and Jony,Gini and Jony Girls Red Printed Regular Fit Shorts
Gini and Jony,Gini and Jony Girls Peach-Coloured Embroidered Top
Soie,Soie Black Solid Non-Wired Non Padded Everyday Bra CB-332BLACK
Parx,Parx Men Red & Black Slim Fit Printed Casual Shirt
ether,ether Women Green Solid Open Toe Flats
Difference of Opinion,Difference of Opinion Men Black Solid Round Neck T-shirt with Side Stripes
Blackberrys,Blackberrys Black Single-Breasted Slim Fit Formal Blazer
Difference of Opinion,Difference of Opinion Men Navy Blue Printed Round Neck T-shirt
MIAH Decor,MIAH Decor Off-White & Green Set of 2 Handpainted Ceramic Coffee Mugs
Campus Sutra,Campus Sutra Men Grey & Blue Regular Fit Checked Casual Shirt
SEJ by Nisha Gupta,SEJ by Nisha Gupta Set of 6 Multicoloured Printed Table Placemats
PARFAIT,PARFAIT Plus Size Black Lace Underwired Non Padded Everyday Bra 3102
Parx,Parx Men Red Slim Fit Checked Casual Shirt
HIGHLANDER,HIGHLANDER Men Navy Blue & Grey Slim Fit Striped Regular Trousers
Story@home,Story@home Beige Floral 210 TC Cotton 1 King Bedsheet with 2 Pillow Covers
Parx,Parx Men Grey Striped Sweater
Playdate,Playdate Girls Black Striped Top
Parx,Parx Men Red & Navy Blue Slim Fit Checked Casual Shirt
Difference of Opinion,Difference of Opinion Men Olive Green Solid Round Neck T-shirt With Side Strip Detail
Rocia,Rocia Women Black & Silver-Toned Wedges
DAVID BECKHAM,DAVID BECKHAM Men Beyond Eau De Toilette 90 ml
JEWEL JUNCTION,JEWEL JUNCTION Gold-Toned Rectangle Cufflinks
ID,ID Men Tan Brown Leather Sneakers
JEWEL JUNCTION,JEWEL JUNCTION Silver-Toned Quirky Cufflinks
SEJ by Nisha Gupta,SEJ by Nisha Gupta Green & Blue Printed Wooden Open Dry Bin
MIAH Decor,MIAH Decor Multicoloured Kitchen Storage Jar with Lid
AccessHer,AccessHer Gold-Plated Embellished Nose Ring with Chain
Marvel by Wear Your Mind,Marvel by Wear Your Mind Boys White Printed Round Neck T-shirt
Palm Tree,Palm Tree Boys Blue Regular Fit Washed Chambray Shirt
HIGHLANDER,HIGHLANDER Men Coral & White Slim Fit Checked Casual Shirt
Parx,Parx Men Mauve Slim Fit Printed Casual Shirt
ID,ID Men Black Solid Leather Thong Flip-Flops
Park Avenue,Park Avenue Women Blue Solid Single-Breasted Blazer
Gini and Jony,Gini and Jony Girls Pink & White Printed Top
Difference of Opinion,Difference of Opinion Men Grey Printed Round Neck T-shirt
Gini and Jony,Gini and Jony Boys Black Slim Fit Printed Regular Trousers
HIGHLANDER,HIGHLANDER Men White & Blue Slim Fit Checked Casual Shirt
Parx,Parx Men Blue Slim Fit Checked Casual Shirt
ID,ID Men Navy Blue Solid Leather Mid-Top Sneakers
Urban Dog,Urban Dog Men Charcoal Printed Regular Fit Sports Shorts
Annabelle by Pantaloons,Annabelle By Pantaloons Off-White Sleeveless Top
Park Avenue,Park Avenue Men Red Solid Jacket
Lady Lyka,Lady Lyka Women Fuschia and Turquoise Blue Pack of 2 T-shirt Bras HAPPY-MOODS-FCA-SKY
AccessHer,AccessHer Women Gold-Plated American Diamond & Ruby Studded Jewelry Set
Homesake,Homesake Gold-Toned Solid Handcrafted Table Lamp with Shade
Sera,Sera Women Sea Green & Maroon Printed Kurta with Palazzos
ether,ether Women Black Solid Slip-Ons
SEJ by Nisha Gupta,SEJ by Nisha Gupta Set of 6 Yellow & Multicoloured Printed Table Placemats
AccessHer,AccessHer Gold-Plated & Red Meenakari Maang Tika
Sera,Sera Women Yellow & Off-White Printed Kurta with Palazzos
TAYHAA,TAYHAA Black & White Square Photo Frame
Park Avenue,Park Avenue Women Blue Solid A-Line Top
her by invictus,her by invictus Women Pink Solid Cushioned Smart Casual Derbys
Palm Tree,Palm Tree Boys Off-White & Grey Printed Polo Collar T-shirt
berrytree,berrytree Girls Pink A-Line Organic Cotton Sustainable Dress
SIMON CARTER LONDON,SIMON CARTER LONDON Men Blue & Pink Slim Fit Printed Casual Shirt
MIAH Decor,MIAH Decor Multicoloured Set Of 6 Printed Khullad Cups
Parx,Parx Men Grey Solid Sweater
DKNY,DKNY Unisex Black Medium Trolley Bag
