Trend,DIY_Technique
Wildcraft,Wildcraft Unisex Blue Hopper 1.0 Brand Logo Printed Laptop Backpack
ColorPlus,ColorPlus Men Green & Blue Regular Fit Checked Casual Shirt
UCLA,UCLA Men Olive Green Printed Round Neck T-shirt
ColorPlus,ColorPlus Men Green Regular Fit Solid Regular Trousers
Tommy Hilfiger,Tommy Hilfiger Men Grey Melange Solid Trunks A9AB4117
PRESTO,PRESTO Blue & Brown Printed Handmade Anti-Skid Woolen Carpet
Tistabene,Tistabene Women Gold-Plated Kundan Jewellery Set
Rubans,Rubans Silver-Toned Contemporary Drop Earrings
DressBerry,DressBerry Women Blue Skinny Fit Mid-Rise Clean Look Stretchable  Ankle Length Jeans
Divine Casa,Divine Casa Green & Navy Blue Solid Heavy Winter 150 GSM Double Bed Comforter
DENNISON,DENNISON Men Black Solid Leather Belt
KazarMax,KazarMax Women Pink & Purple Ombre Print Thong Flip-Flops
Indian Terrain,Indian Terrain Men Pink Slim Fit Solid Casual Shirt
Indian Terrain,Indian Terrain Men Pink & Navy Blue Chiseled Slim Fit Checked Smart Casual Shirt
Indian Terrain,Indian Terrain Men Blue Solid Insulator Padded Jacket
CAVALLO by Linen Club,CAVALLO by Linen Club Men Cotton Linen Brown & Navy Blue Regular Fit Checked Casual Shirt
Indian Terrain,Indian Terrain Men Navy Blue Slim Fit Printed Smart Casual Shirt
Indian Terrain,Indian Terrain Men Rust Orange & White Slim Fit Checked Casual Shirt
Mufti,Mufti Men Blue Regular Fit Mid-Rise Clean Look Stretchable Jeans
Indian Terrain,Indian Terrain Men Grey Solid Reversible Padded Jacket
Tistabene,Tistabene Pink & Gold-Plated Contemporary Chandbalis
Indian Terrain,Indian Terrain Men Green & White Slim Fit Checked Casual Shirt
Indian Terrain,Indian Terrain Men Blue Slim Fit Solid Linen Smart Casual Shirt
Indian Terrain,Indian Terrain Men Rust Orange Slim Fit Solid Casual Shirt
Indian Terrain,Indian Terrain Men Blue & White Slim Fit Checked Smart Casual Shirt
Indian Terrain,Indian Terrain Men Teal Blue & Beige Slim Fit Checked Smart Casual Shirt
Tistabene,Tistabene Women Gold-Plated Polki Designer Jewellery Set
Ginger by Lifestyle,Ginger by Lifestyle Women Black Solid Cropped Skinny Fit Jeggings
ColorPlus,ColorPlus Men Orange & Black Regular Fit Checked Casual Shirt
Mufti,Mufti Men Yellow Printed Polo Collar T-shirt
BIANCA,BIANCA Blue Self Design Rectangular Bath Rug
Indian Terrain,Indian Terrain Men Olive Green Slim Fit Solid Smart Casual Linen Shirt
Indian Terrain,Indian Terrain Men Red & White Slim Fit Striped Casual Shirt
Indian Terrain,Indian Terrain Men Blue Slim Fit Printed Casual Shirt
Tommy Hilfiger,Tommy Hilfiger Unisex Navy Blue Checked Laptop Backpack
Indian Terrain,Indian Terrain Men Yellow Slim Fit Micro Ditsy Printed Cotton Linen Smart Casual Shirt
Ginger by Lifestyle,Ginger by Lifestyle Women Black Regular Fit Solid Regular Trousers
Indian Terrain,Indian Terrain Men Blue Slim Fit Solid Chambray Smart Casual Shirt
Indian Terrain,Indian Terrain Men Navy Blue Printed Sweatshirt
hummel,Hummel Women Black Printed Tights
Tistabene,Tistabene Women Gold-Plated Handcrafted Kundan Polki Ring
Indian Terrain,Indian Terrain Men Khaki & Brown Slim Fit Checked Casual Shirt
Indian Terrain,Indian Terrain Men White & Grey Slim Fit Printed Casual Shirt
KazarMax,KazarMax Women Sea Green & Pink Floral Print Thong Flip-Flops
Indian Terrain,Indian Terrain Men Rust Red Slim Fit Solid Linen Smart Casual Shirt
Indian Terrain,Indian Terrain Men Mustard Yellow & Brown Chiseled Slim Fit Checked Casual Shirt
Indian Terrain,Indian Terrain Men Pink Slim Fit Solid Smart Casual Shirt
Indian Terrain,Indian Terrain Men Burgundy & Navy Blue Slim Fit Striped Smart Casual Shirt
U.S. Polo Assn.,U.S. Polo Assn. Men Navy Blue Sneakers
Indian Terrain,Indian Terrain Men Navy Blue Solid Sweatshirt
Tistabene,Tistabene Gold-Plated & Turquoise Blue Contemporary Chandbalis
Indian Terrain,Indian Terrain Men Blue Slim Fit Faded Chambray Casual Shirt
Indian Terrain,Indian Terrain Men Navy Blue Slim Fit Printed Corduroy Casual Shirt
Indian Terrain,Indian Terrain Men Red Solid Puffer Jacket
PRESTO,PRESTO Beige and Black Printed Handmade Anti-Skid Woolen Carpet
BIANCA,BIANCA Orange Solid 1700 GSM Bath Rug
Cherry Crumble,Cherry Crumble Unisex Kids Navy Blue Colourblocked Polo Collar T-shirt
Da Intimo,Da Intimo Beige Solid Cotton Lightly Padded Non-Wired T-shirt Bra DI-1229
Karmic Vision,Karmic Vision Women Black & White Solid Top with Dungaree
Indian Terrain,Indian Terrain Men Maroon & Navy Blue Chiseled Slim Fit Checked Casual Shirt
INDYA,INDYA Women Brown Floral Printed Maxi Dress
Indian Terrain,Indian Terrain Men Navy Blue & Brown Slim Fit Checked Casual Shirt
Karmic Vision,Karmic Vision Women Black Lace Insert Basic Jumpsuit
Indian Terrain,Indian Terrain Men Charcoal Grey Printed Regular Fit Single-Breasted Casual Blazer
Fame Forever by Lifestyle,Fame Forever by Lifestyle Men White Solid Regular Fit Regular Shorts
Duke,Duke Men Black Solid Formal Brogues
Ecko Unltd,Ecko Unltd Men Navy Blue Printed Hood T-shirt
Taavi,Taavi Men Off-White & Red Ikat Woven Design Straight Kurta with Roll-Up Sleeves
Ginger by Lifestyle,Ginger by Lifestyle Women Navy Blue Solid Skinny Fit Jeggings
DressBerry,DressBerry Women Rust Orange & White Checked A-Line Dress
Ginger by Lifestyle,Ginger by Lifestyle Women Black Regular Fit Solid Regular Trousers
Rubans,Rubans Silver-Toned & White Handcrafted Feather Shaped Drop Earrings
Indian Terrain,Indian Terrain Men Brown & Blue Regular Fit Checked Casual Shirt
Indian Terrain,Indian Terrain Men Blue & White Slim Fit Printed Smart Casual Shirt
Kvsfab,Kvsfab Navy Solid Poly Georgette Saree
Louis Philippe,Louis Philippe Men Blue Slim Fit Solid Formal Shirt
Saree mall,Saree mall Beige & Navy Blue Printed Saree
Indian Terrain,Indian Terrain Men Beige & Brown Slim Fit Ditsy Floral Printed Casual Shirt
Ecko Unltd,Ecko Unltd Men Black Printed Hood T-shirt
Voylla,Voylla Women Brass-Plated Stone-Studded Jewellery Set
Tistabene,Tistabene Gold-Plated & Pink Contemporary Enamelled Drop Earrings
Indian Terrain,Indian Terrain Men Blue Slim Fit Printed Casual Shirt
Indian Terrain,Indian Terrain Men Off-White Slim Fit Solid Casual Shirt
DressBerry,DressBerry Women Blue Embroidered Denim A-Line Dress
Indian Terrain,Indian Terrain Men Burgundy Slim Fit Checked Casual Shirt
ADIVA,ADIVA Girls Blue Fit and Flare Dress
Park Avenue,Park Avenue Men Blue Solid Briefs PZRR00125
Indian Terrain,Indian Terrain Men Brown & Navy Blue Chiseled Fit Checked Casual Shirt
SWHF,SWHF Brown & Black Premium Coir and Rubber Printed Mat
Indian Terrain,Indian Terrain Men Coral Pink & Navy Blue Chiseled Slim Fit Checked Smart Casual Shirt
ColorPlus,ColorPlus Men Navy Blue Regular Fit Solid Regular Trousers
Indian Terrain,Indian Terrain Men Burgundy & Olive Green Slim Fit Checked Casual Shirt
Indian Terrain,Indian Terrain Men Brown Slim Fit Printed Smart Casual Shirt
Mufti,Mufti Men Blue Slim Fit Mid-Rise Clean Look Stretchable Jeans
Indian Terrain,Indian Terrain Men Navy Blue & Red Slim Fit Checked Smart Casual Shirt
Indian Terrain,Indian Terrain Men White & Beige Slim Fit Checked Smart Casual Linen Shirt
Tommy Hilfiger,Tommy Hilfiger Men Navy Blue Solid Trunk A9AB4124
HRX by Hrithik Roshan,HRX by Hrithik Roshan Men White Printed Rapid Dry Lightweight Regular Fit Running T-shirt
Mufti,Mufti Men Blue & Red Printed Round Neck Slim Fit T-shirt
PRESTO,PRESTO Navy Blue Printed Hand Tufted Woolen Carpet
Hypernation,Hypernation Women Orange Solid Open Front Shrug
DressBerry,DressBerry Women Black Solid Tights
Indian Terrain,Indian Terrain Men Maroon & Beige Slim Fit Printed Smart Casual Shirt
Indian Terrain,Indian Terrain Men Yellow & Navy Blue Chiseled Slim Fit Checked Smart Casual Shirt
Kvsfab,Kvsfab Cream-Coloured Embroidered Poly Georgette Saree
Kvsfab,Kvsfab Green & Silver-Toned Self-Checked Linen Blend Saree
DressBerry,DressBerry Women Mustard Yellow Printed Round Neck T-shirt
Indian Terrain,Indian Terrain Men Black Slim Fit Solid Smart Casual Shirt
BIANCA,BIANCA Purple Solid 1700 GSM Bath Rug
Indian Terrain,Indian Terrain Men Grey Slim Fit Solid Linen Smart Casual Shirt
Indian Terrain,Indian Terrain Men Blue Slim Fit Printed Smart Casual Shirt
Zaveri Pearls,Zaveri Pearls Gold-Toned Temple Jewellery Set
Flying Machine,Flying Machine Women Black Skinny Fit Mid-Rise Clean Look Jeans
DressBerry,DressBerry Women Blue Self Design High-Low Chambray Top
Wildcraft,Wildcraft Unisex Black Trident 2.0 Brand Logo Backpack
DressBerry,DressBerry Women Blue Skinny Fit Mid-Rise Highly Distressed Stretchable Jeans
GAP,GAP Women's Vintage Soft Graphic Sweatshirt
Indian Terrain,Indian Terrain Men Yellow & Beige Slim Fit Checked Smart Casual Linen Shirt
ADIVA,ADIVA Girls Red Self-Design Fit and Flare Dress
Indian Terrain,Indian Terrain Men Pink & Blue Slim Fit Checked Smart Casual Shirt
Indian Terrain,Indian Terrain Men Navy Blue & White Slim Fit Striped Smart Casual Shirt
Indian Terrain,Indian Terrain Boys Grey Melange Self-Design Casual Blazer
DressBerry,DressBerry Women Blue Skinny Fit Mid-Rise Low Distress Stretchable Cropped Jeans
Soie,Soie Women Blue Printed Knee-Length Sleep Shirts NT-98BRITTNEY-BLUE-7
Kraus Jeans,Kraus Jeans Women K4050 Blue Slim Fit Mid-Rise Clean Look Stretchable Cropped Jeans
Indian Terrain,Indian Terrain Men White & Blue Slim Fit Checked Smart Casual Linen Shirt
Indian Terrain,Indian Terrain Men White Slim Fit Solid Smart Casual Shirt
Karmic Vision,Karmic Vision Women Blue Solid A-Line Skirt
Steenbok,Steenbok Men Grey Printed Round Neck T-shirt
Indian Terrain,Indian Terrain Men Khaki Regular Fit Solid Smart Casual Linen Shirt
Indian Terrain,Indian Terrain Men Rust Orange & Beige Slim Fit Checked Smart Casual Linen Shirt
Indian Terrain,Indian Terrain Men Green & White Regular Fit Checked Casual Shirt
Ecko Unltd,Ecko Unltd Men Blue & Olive Green Slim Fit Checked Casual Shirt
Tommy Hilfiger,Tommy Hilfiger Men Navy Solid Briefs A9AB1130
Indian Terrain,Indian Terrain Men Yellow Slim Fit Printed Casual Shirt
Karmic Vision,Karmic Vision Women Yellow Solid Playsuit
Disney by Wear Your Mind,Disney by Wear Your Mind Boys Orange & Black Printed Round Neck T-shirt
Indian Terrain,Indian Terrain Men Blue & White Slim Fit Checked Smart Casual Shirt
Indian Terrain,Indian Terrain Men Brown & White Chiseled Fit Checked Casual Shirt
Oxolloxo,Oxolloxo Women Blue Printed Wrap Dress
Kvsfab,Kvsfab Yellow Checked Linen Blend Saree
Bhama Couture,Bhama Couture Women Red Self Design Kurta with Palazzos
ColorPlus,ColorPlus Men White Tailored Fit Self Design Casual Shirt
Tresmode,Tresmode Men Brown Leather Loafers
DressBerry,DressBerry Women Blue Skinny Fit Mid-Rise Clean Look Stretchable Cropped Jeans
Indian Terrain,Indian Terrain Men Peach-Coloured & Navy Blue Chiseled Slim Fit Checked Smart Casual Shirt
Indian Terrain,Indian Terrain Men White & Blue Slim Fit Checked Casual Shirt
Kvsfab,Kvsfab Peach-Coloured Printed Cotton Blend Saree
PRESTO,Presto Multicolored Printed Hand Tufted Wool Carpet
Disney by Wear Your Mind,Disney by Wear Your Mind Boys Brown Printed Round Neck T-shirt
Indian Terrain,Indian Terrain Men Green & White Slim Fit Checked Smart Casual Shirt
Indian Terrain,Indian Terrain Men Brown & White Slim Fit Checked Semiformal Shirt
Tresmode,Tresmode Men Blue Solid Thong Flip-Flops
Indian Terrain,Indian Terrain Men Grey & Purple Slim Fit Checked Smart Casual Shirt
E2O,E2O Women Olive Green Solid Zip Around Wallet
hummel,Hummel Men Grey Self-Design Straight-Fit Track Pant
UCLA,UCLA Men Blue Printed Round Neck T-shirt
DressBerry,DressBerry Women Blue Skinny Fit Mid-Rise Clean Look Stretchable Ankle Length Jeans
Kvsfab,Kvsfab Beige Printed Poly Georgette Saree
meriggiare,meriggiare Women Purple Sneakers
Indian Terrain,Indian Terrain Men Brown & Blue Slim Fit Checked Casual Shirt
Mast & Harbour,Mast & Harbour Men Blue Solid Casual Shirt
Indian Terrain,Indian Terrain Men Off-White Slim Fit Self Design Smart Casual Shirt
Indian Terrain,Indian Terrain Men Blue Slim Fit Solid Smart Casual Shirt
Tistabene,Tistabene Gold-Plated Contemporary Drop Earrings
Mufti,Mufti Men Blue Slim Fit Mid-Rise Low Distress Stretchable Jeans
DressBerry,DressBerry Women Maroon & Black Striped A-Line Skirt
CAVALLO by Linen Club,CAVALLO by Linen Club Men Cotton Linen Blue & Red Regular Fit Checked Casual Shirt
meriggiare,meriggiare Women Blue Woven Design Sneakers
Indian Terrain,Indian Terrain Men Navy Blue & White Chiseled Slim Fit Checked Casual Shirt
Mufti,Mufti Men Blue Regular Fit Mid-Rise Clean Look Stretchable Jeans
Bhama Couture,Bhama Couture Women Pink & White Printed Kurta with Palazzos
Miss Chase,Miss Chase Women Maroon Shirt Dress
Indian Terrain,Indian Terrain Men Red & White Slim Fit Checked Smart Casual Shirt
Ginger by Lifestyle,Ginger by Lifestyle Women Black Jeggings
Indian Terrain,Indian Terrain Men Rust Brown Solid Sweater
E2O,E2O Women Yellow Solid Zip Around Wallet
Soie,Soie Women Brown Printed Knee-Length Sleep Shirts NT-98DEEP-MAHOGANY-3
Indian Terrain,Indian Terrain Men Olive Green Solid Puffer Jacket
Steenbok,Steenbok Men Black Solid Polo Collar T-shirt
CODE by Lifestyle,CODE by Lifestyle Men Blue Printed Polo Collar T-shirt
Indian Terrain,Indian Terrain Men Charcoal Grey Solid Front-Open Sweater
Tistabene,Tistabene Green & Gold-Plated Contemporary Jhumkas
Melange by Lifestyle,Melange by Lifestyle Men Orange Printed Straight Kurta
Indian Terrain,Indian Terrain Men Pink & Blue Chiseled Slim Fit Checked Casual Shirt
Indian Terrain,Indian Terrain Men White & Black Slim Fit Striped Smart Casual Shirt
GIORDANO,GIORDANO Women Silver-Toned Solid Open Toe Flats
E2O,E2O Women Pink Solid Zip Around Wallet
Indian Terrain,Indian Terrain Men Blue & Maroon Slim Fit Checked Smart Casual Linen Shirt
Indian Terrain,Indian Terrain Men Black & White Slim Fit Checked Smart Casual Shirt
Indian Terrain,Indian Terrain Men Grey Melange Solid Sweater Vest
Indian Terrain,Indian Terrain Men Rust Red Slim Fit Solid Smart Casual Shirt
Kurti's by Menka,Kurti's by Menka Women Pink Yoke Design A-Line Kurta
ONLY,ONLY Mint Green Sequinned Tank Top
Indian Terrain,Indian Terrain Men Green & Yellow Slim Fit Checked Casual Shirt
Indian Terrain,Indian Terrain Men Red & Black Slim Fit Checked Casual Shirt
Kurti's by Menka,Kurti's by Menka Women Beige Solid Straight Kurta
DressBerry,DressBerry Women Green & Red Regular Fit Striped Cropped Regular Trousers
Kvsfab,Kvsfab Mauve & Black Printed Poly Georgette Saree
Indian Terrain,Indian Terrain Men Navy Slim Fit Printed Casual Shirt
Indian Terrain,Indian Terrain Men Brown Slim Fit Solid Casual Shirt
Indian Terrain,Indian Terrain Men Burgundy & Black Chiseled Slim Fit Printed Casual Shirt
Tistabene,Tistabene Gold-Plated & Pink Contemporary Chandbalis
Indian Terrain,Indian Terrain Men Navy Blue & Mustard Self Design Sweater
Tistabene,Tistabene Gold-Plated & Off-White Contemporary Jhumkas
E2O,E2O Navy Blue Solid Sling Bag
Indian Terrain,Indian Terrain Men White & Violet Chiseled Slim Fit Striped Casual Shirt
Indian Terrain,Indian Terrain Men Green & White Slim Fit Checked Casual Shirt
Tommy Hilfiger,Tommy Hilfiger Men Pack of 3 Solid Briefs A9AB1119
Ginger by Lifestyle,Ginger by Lifestyle Women Black Straight Fit Mid-Rise Clean Look Jeans
Just Wow,Just Wow Women Red Regular Fit Solid Cigarette Trousers
CUTECUMBER,CUTECUMBER Girls Blue Printed Top
Indian Terrain,Indian Terrain Men Maroon Regular Fit Striped Casual Shirt
Indian Terrain,Indian Terrain Men Grey & Purple Slim Fit Checked Casual Shirt
CODE by Lifestyle,CODE by Lifestyle Men Green Solid Polo Collar T-shirt
Indian Terrain,Indian Terrain Men Blue & White Slim Fit Checked Casual Shirt
Mast & Harbour,Mast & Harbour Men Pink & Blue Regular Fit Checked Casual Shirt
Fame Forever by Lifestyle,Fame Forever by Lifestyle Men Red Solid Polo Collar T-shirt
Indian Terrain,Indian Terrain Men Red & Blue Regular Fit Checked Casual Shirt
Indian Terrain,Indian Terrain Men Navy Blue & Beige Slim Fit Checked Smart Casual Shirt
Indian Terrain,Indian Terrain Men Green & White Slim Fit Striped Smart Casual Shirt
Ecko Unltd,Ecko Unltd Men Blue Slim Tapered Fit Mid-Rise Clean Look Stretchable Ankle Length Jeans
Tommy Hilfiger,Tommy Hilfiger Men Navy Blue & Light Green Printed Trunk A9AB4135
Indian Terrain,Indian Terrain Men Grey & Purple Chiseled Fit Checked Casual Shirt
Soie,Soie Women Lime Green Printed Knee-Length Sleep Shirts NT-98SHADOW-LIME-8
DressBerry,DressBerry Women Blue Regular Fit Solid Denim Cropped Jeggings
Voylla,Voylla Women Brass-Plated & Red Enamelled Handcrafted Maang Tikka
Tommy Hilfiger,Tommy Hilfiger Men Pack of 3 Trunks A9AB4160
Park Avenue,Park Avenue Men Dark Grey Solid Pure Cotton Boxers PZUA00384-G8
Indian Terrain,Indian Terrain Men Brown & Navy Blue Regular Fit Checked Casual Shirt
Indian Terrain,Indian Terrain Men Red & White Slim Fit Checked Smart Casual Shirt
Kvsfab,Kvsfab Brown Printed Cotton Blend Saree
Roadster,Roadster Men Grey Melange Solid Hooded Sweatshirt
Tresmode,Tresmode Men Black Leather Formal Monks
DressBerry,DressBerry Women Green & Yellow Striped Shirt Dress
Flying Machine,Flying Machine Women Blue Skinny Fit Mid-Rise Clean Look Stretchable Jeans
CAVALLO by Linen Club,CAVALLO by Linen Club Men Cotton Linen Brown Regular Fit Checked Casual Shirt
Indian Terrain,Indian Terrain Men Green & Black Slim Fit Checked Casual Shirt
Indian Terrain,Indian Terrain Men Maroon & White Slim Fit Checked Linen Casual Shirt
Hypernation,Hypernation Women Pink Solid Open Front Shrug
Indian Terrain,Indian Terrain Men Black & White Slim Fit Striped Casual Shirt
Indian Terrain,Indian Terrain Men Red & Grey Slim Fit Checked Smart Casual Shirt
Indian Terrain,Indian Terrain Men Mustard Yellow Solid Sweater
Roadster,Roadster Men Coffee Brown Solid Puffer Jacket
DressBerry,DressBerry Women Printed Navy Blue & White A-Line Dress
KazarMax,KazarMax Women Navy Blue & Pink Floral Print Thong Flip-Flops
Indian Terrain,Indian Terrain Men Brown & Blue Slim Fit Checked Casual Shirt
Duke,Duke Men Navy Blue Textile Running Shoes
Ginger by Lifestyle,Ginger by Lifestyle Women Black Solid Skinny Fit Jeggings
DressBerry,DressBerry Women Red & White Floral Print Regular Top
PRESTO,PRESTO Orange & Grey Printed Hand Tufted Woolen Carpet
Vero Moda,Vero Moda White & Grey Houndstooth Print Sheath Dress
DressBerry,DressBerry Women Burgundy & Navy Blue Striped A-Line Dress
E2O,E2O Yellow Solid Sling Bag
Kvsfab,Kvsfab Maroon Solid Poly Georgette Saree
Indian Terrain,Indian Terrain Men Green & Navy Blue Regular Fit Checked Casual Shirt
DressBerry,DressBerry Women Blue Flared Fit Mid-Rise Clean Look Stretchable Ankle Length Jeans
HAMMER,Hammer Grip Blue Sports Bluetooth Wireless Earphones
CODE by Lifestyle,CODE by Lifestyle Men Blue Printed Polo Collar T-shirt
Melange by Lifestyle,Melange by Lifestyle Men Burgundy Checked Straight Kurta
ColorPlus,ColorPlus Men Pink Slim Fit Solid Casual Shirt
Indian Terrain,Indian Terrain Men Black & Grey Slim Fit Printed Smart Casual Shirt
Indian Terrain,Indian Terrain Men Red & White Slim Fit Checked Smart Casual Shirt
Indian Terrain,Indian Terrain Men Grey Slim Fit Self Design Casual Shirt
Bhama Couture,Bhama Couture Women Yellow Solid Kurta with Palazzos & Dupatta
Tistabene,Tistabene Gold-Plated & Sea Green Contemporary Drop Earrings
Tistabene,Tistabene Women Gold-Plated Kundan Polki Pearls Jewellery Set
Indian Terrain,Indian Terrain Men Teal Blue Striped Front-Open Sweater
Indian Terrain,Indian Terrain Men Navy Blue Chiseled Slim Fit Solid Casual Shirt
Indian Terrain,Indian Terrain Men Black Slim Fit Printed Pure Cotton Casual Shirt
Indian Terrain,Indian Terrain Men Charcoal Grey Self Design Single Breasted Semi-Formal Blazer
Tistabene,Tistabene Gold-Plated & Red Contemporary Jhumkas
Ginger by Lifestyle,Ginger by Lifestyle Women Blue Skinny Fit Mid-Rise Clean Look Jeans
Duke,Duke Men Black Sports Sandals
Duke,Duke Men Red & Black Sports Sandals
Tommy Hilfiger,Tommy Hilfiger Men Pack of 3 Solid White Briefs A9AB1127
Indian Terrain,Indian Terrain Men Pink & Navy Blue Slim Fit Checked Smart Casual Shirt
Kurti's by Menka,Kurti's by Menka Women Maroon & Mustard Yellow Printed Straight Kurta
Ginger by Lifestyle,Ginger by Lifestyle Women White Straight Fit Mid-Rise Clean Look Jeans
Tistabene,Tistabene Gold-Plated Green Teardrop Shaped Drop Earrings
GAP,GAP Womens V-Neck Pullover Sweater
Indian Terrain,Indian Terrain Men Brown & Blue Chiseled Slim Fit Checked Casual Shirt
Indian Terrain,Indian Terrain Men Black Chiseled Slim Fit Solid Smart Casual Shirt
Indian Terrain,Indian Terrain Men Green Slim Fit Self Design Smart Casual Shirt
Indian Terrain,Indian Terrain Men Navy Blue & Red Chiseled Slim Fit Checked Smart Casual Shirt
ROMEE,ROMEE Grey Set of 2 Door Curtains
GAP,GAP Women's Cardigan Sweater
UCLA,UCLA Men White Printed Round Neck T-shirt
Soie,Soie Women Lime Green Printed Lounge Pants NT-121PJ-1-PJ-1
Ginger by Lifestyle,Ginger by Lifestyle Women Olive Brown Solid Round Neck T-shirt
Eske,Eske Black Colourblocked Leather Handheld Bag
Indian Terrain,Indian Terrain Men Grey & Purple Slim Fit Checked Smart Casual Shirt
Mufti,Mufti Men Blue Slim Fit Mid-Rise Clean Look Stretchable Jeans
GAP,GAP Women's Vintage Soft Logo Raglan Sweatshirt
Tistabene,Tistabene Gold-Plated Dome Shaped Jhumkas
ColorPlus,ColorPlus Men Blue Regular Fit Solid Chinos
Eske,Eske Blue Textured Crusader Hard-Sided Cabin Trolley Bag
Ginger by Lifestyle,Ginger by Lifestyle Women Black Straight Fit Mid-Rise Clean Look Jeans
BIANCA,BIANCA Pink Self Design Micro-Chenille Bath Rug
CAVALLO by Linen Club,CAVALLO by Linen Club Men Cotton Linen Brown Regular Fit Checked Casual Shirt
Indian Terrain,Indian Terrain Men White & Navy Blue Regular Fit Checked Casual Shirt
DressBerry,DressBerry Women Blue Skinny Fit Mid-Rise Clean Look Stretchable Jeans
Indian Terrain,Indian Terrain Men Navy Blue & Olive Green Slim Fit Striped Casual Shirt
Fame Forever by Lifestyle,Fame Forever by Lifestyle Men Navy Blue Striped Round Neck T-shirt
KazarMax,KazarMax Women White & Pink Printed Thong Flip-Flops
Indian Terrain,Indian Terrain Men Blue & White Slim Fit Checked Casual Shirt
Indian Terrain,Indian Terrain Men Teal Blue & Black Regular Fit Checked Casual Shirt
Vero Moda,Vero Moda Black Eyelet Top
Tommy Hilfiger,Tommy Hilfiger Men White Solid Trunks A9AB4123
Bhama Couture,Bhama Couture Women Pink Candy Pure Cotton Striped Floral Detail Shirt Style Top
DressBerry,DressBerry Women Multicoloured Printed A-Line Dress
Indian Terrain,Indian Terrain Men White & Navy Blue Self Design Single Breasted Semi-Formal Blazer
BIANCA,BIANCA Turquoise Blue Self Design Micro-Chenille Bath Rug
Vero Moda,Vero Moda Yellow Printed Top
Melange by Lifestyle,Melange by Lifestyle Men Beige Printed Straight Kurta
DressBerry,DressBerry Women Black Flared Mid-Rise Clean Look Stretchable Jeans
GAP,GAP Women's Cardigan Sweater
Indian Terrain,Indian Terrain Men Blue & White Slim Fit Checked Smart Casual Shirt
FAUSTO,FAUSTO Men Grey Slip-On Sneakers
Ginger by Lifestyle,Ginger by Lifestyle Women Navy Blue Solid Skinny Fit Jeggings
Bhama Couture,Bhama Couture Women Green Embroidered Shirt Style Top
Kvsfab,Kvsfab Women Beige & Grey Cotton Blend Printed Saree
Tommy Hilfiger,Tommy Hilfiger Men Red & Navy Blue Printed Trunks A9AB4134
Soie,Soie Women Blue Printed Knee-Length Sleep Shirt NT-98BLUE-TINT-5
ColorPlus,ColorPlus Men Orange & Red Regular Fit Checked Casual Shirt
U.S. Polo Assn.,U.S. Polo Assn. Men Navy Blue Loafers
KazarMax,KazarMax Women White & Blue Printed Thong Flip-Flops
meriggiare,meriggiare Women Blue Sneakers
Kvsfab,Kvsfab Black & Grey Cotton Blend Printed Saree
Arrow,Arrow Men Black Leather Sandals
Tistabene,Tistabene Gold-Plated & Red Contemporary Jhumkas
Indian Terrain,Indian Terrain Men Yellow & White Slim Fit Checked Smart Casual Shirt
ADIVA,ADIVA Girls Yellow Fit and Flare Dress
Indian Terrain,Indian Terrain Men Green & Beige Slim Fit Checked Smart Casual Shirt
Indian Terrain,Indian Terrain Men Multicoloured Slim Fit Checked Smart Casual Linen Shirt
Indian Terrain,Indian Terrain Men Red Printed Sweatshirt
Indian Terrain,Indian Terrain Men White Regular Fit Printed Casual Shirt
Indian Terrain,Indian Terrain Men Blue Slim Fit Checked Smart Casual Shirt
Tistabene,Tistabene Gold-Plated & Red Contemporary Drop Earrings
Indian Terrain,Indian Terrain Men Yellow & Brown Slim Fit Checked Linen Casual Shirt
Mast & Harbour,Mast & Harbour Men Green Printed Casual Shirt
Indian Terrain,Indian Terrain Men Grey Slim Fit Self Design Smart Casual Shirt
Tommy Hilfiger,Tommy Hilfiger Men Navy Blue Solid Briefs A9AB1133
Tistabene,Tistabene Gold-Plated Red Contemporary Drop Earrings
Indian Terrain,Indian Terrain Men Navy Blue Striped Pullover Sweater
Indian Terrain,Indian Terrain Men Rust Brown Self Design Pullover Sweater
Indian Terrain,Indian Terrain Men Blue & White Slim Fit Checked Smart Casual Shirt
Indian Terrain,Indian Terrain Men Navy Blue & Off-White Slim Fit Checked Smart Casual Shirt
Indian Terrain,Indian Terrain Men Green & Beige Slim Fit Printed Casual Shirt
Indian Terrain,Indian Terrain Men Navy Blue Chiseled Slim Fit Self Checked Smart Casual Shirt
Flying Machine,Flying Machine Women Blue Veronica Skinny Fit High-Rise Clean Look Stretchable Jeans
Disney by Wear Your Mind,Disney by Wear Your Mind Boys Yellow Printed Round Neck T-shirt
Indian Terrain,Indian Terrain Men Red & Blue Slim Fit Checked Casual Shirt
Indian Terrain,Indian Terrain Men Navy Blue & White Self Design Regular Fit Smart Casual Blazer
ColorPlus,ColorPlus Men Blue Regular Fit Self Design Casual Shirt
HERE&NOW,HERE&NOW Women Navy Blue Solid A-Line Top
Indian Terrain,Indian Terrain Men Blue & White Slim Fit Checked Smart Casual Shirt
Vero Moda,Vero Moda Multicoloured Printed Top
